Name,Descriptions,Keywords
Aboleth,"The Aboleth is a large, Lovecraftian creature that lurks in the dark depths of the ocean. It is a fearsome predator, with a long, slimy body and a multitude of tentacles that it uses to ensnare its prey. The Aboleth is a fearsome foe, and will not hesitate to devour anything that crosses its path.","Monsters , The ocean , Prey , Fear"
Acolyte of the Abyss',"The Acolyte of the Abyss is a fearsome creature that lurks in the dark corners of Lordran. It is a humanoid creature with black, leathery skin and glowing red eyes. It wields a large scythe in one hand and has long, sharp claws on the other. It is a dangerous foe that should not be underestimated.","Horror , Darkness , Evil , Demons"
Adult Black Dragon,"The Adult Black Dragon is a massive, black dragon that is feared by all who cross its path. It is a ferocious creature that will stop at nothing to destroy its enemies. It has razor sharp claws and teeth, and its powerful tail can crush anything in its way. This dragon is not to be underestimated, and those who face it should be prepared for a long and difficult battle.","Danger,, Strength, , Destruction, , Fear"
Adult Blue Dragon,"The Adult Blue Dragon is a massive, flying creature with blue scales and razor-sharp claws. It breathes fire and is extremely dangerous. It is found in the darkest depths of the game world and is feared by all who encounter it.","Danger , Fire , Flying , Scale"
Adult Brass Dragon,"The Adult Brass Dragon is a massive, flying creature with golden scales and a long, serpentine body. It has large, leathery wings, and a long, barbed tail. Its head is adorned with a crown of horns, and its eyes glow red with heat. It breathes fire, and its claws and teeth are sharp as blades. This dragon is feared by all who know of it, for it is a ruthless and powerful predator.","Powerful , Flying , Serpentine , Red eyes"
Adult Bronze Dragon,"The Adult Bronze Dragon is a massive creature, towering over most other creatures in the game. It is covered in shining bronze scales, with great wings that allow it to fly. It is a fearsome creature, capable of breathe fire and crushing its opponents with its powerful claws.","Powerful , Flying , Fire , Scales"
Adult Copper Dragon,"The Adult Copper Dragon is a massive, flying reptile with scaly, copper-colored skin. It has large, leathery wings, and a long, snake-like body. Its head is adorned with horns, and it has a long, barbed tail. It is a fearsome creature, and is capable of breathing fire.","Dragons , Fire , Flying , Reptile"
Adult Gold Dragon,"The Adult Gold Dragon is a massive, flying reptilian creature with golden scales covering its body. It has large, leathery wings, and a long tail that ends in a sharp point. Its head is adorned with horns, and it has a long, snake-like tongue. It is a fearsome creature, and is known to be highly intelligent and magical. It is said that they are able to breathe fire, and that their claws and teeth are poisonous.","Adventure , Dragons , Magical creatures , Intelligence"
Adult Green Dragon,"The Adult Green Dragon is a massive creature with scaly green skin and large wings. It has a long neck and tail, and its head is adorned with horns. Its eyes are glowing green, and its mouth is full of sharp teeth. It is a fearsome creature, and it is said that its breath is deadly.","Animalistic , Dangerous , Fearsome , Powerful"
Adult Red Dragon,"The Adult Red Dragon is a massive, powerful creature that dwells in dark caves and lurks in the shadows, waiting to ambush its prey. It has a long, sinuous body covered in red scales, and a long tail that it uses to lash out at its enemies. It has large, leathery wings that it uses to fly, and sharp claws and teeth that it uses to rend and tear its victims.","Danger,, Violence, , Revenge, , Bloodshed"
Adult Silver Dragon,"The Adult Silver Dragon is a massive, powerful creature that is feared by all who know of it. It is said to be immune to all forms of magic and has razor sharp claws and teeth that can rend flesh and bone with ease. It is a fearsome opponent that should not be underestimated.","Powerful , Magic , Immune to magic , Fearsome"
Adult White Dragon,"The Adult White Dragon is a massive creature that towers over most other enemies in the game. It is incredibly powerful, and its icy breath can easily freeze and kill most players. It is a fearsome opponent, and only the most experienced and well-prepared players will stand a chance against it.","Powerful , Fearful , Deadly , Cold"
Air Elemental,"This monster is a floating being made entirely of air. It is invisible to the naked eye, but can be seen as a swirling mass of air. It is incredibly agile and can move at high speeds. It attacks by firing gusts of wind at its enemies, or by slamming into them with great force.","Air Elementals are often associated with wind, air, and the sky. , Air Elementals can be very agile and fast, making them difficult to hit. , Air Elementals can attack with gusts of wind or by slamming into their enemies. , Air Elementals can be a symbol of freedom, mobility, and the sky."
Allosaurus,"The Allosaurus is a large, predatory dinosaur that roams the dark forests of Lordran. It is a fearsome creature, with sharp teeth and claws that can rend flesh from bone. It is also fast and agile, making it a difficult foe to defeat.","Monsters , Dinosaurs , Forests , Terrors"
Ancient Black Dragon,"The Ancient Black Dragon is a massive, black dragon that dwells in the dark depths of the world. It is a fearsome creature, with razor sharp claws and teeth, and a long, barbed tail. It is said that this dragon is ancient, and has been alive for centuries. It is a powerful creature, and is feared by all who know of it.","Ancient , Black , Dragon , Dark"
Ancient Blue Dragon,"The Ancient Blue Dragon is a massive, dragon-like creature that is said to be as old as the first dragon. It is said to be so large that it can block out the sun with its body. It is said to have a blue aura that is said to be able to freeze anything it touches. It is said to be one of the most powerful creatures in the world and is said to be nearly impossible to kill.","Ancient Blue Dragon , Powerful , Difficult to Kill , Blue Aura"
Ancient Brass Dragon,"The Ancient Brass Dragon is a massive, dragon-like creature made entirely of brass. It has four massive wings, and a long tail that ends in a sharp point. Its body is covered in intricate patterns and designs, and its eyes glow a bright red. It is an incredibly powerful creature, and is said to be nearly impossible to defeat.","Mythology/Fantasy , Technology , Strength/Power , Dragons"
Ancient Bronze Dragon,"The Ancient Bronze Dragon is a massive, dragon-like creature that is covered in bronze scales. It has large, leathery wings, and a long tail that ends in a sharp point. Its head is adorned with horns, and its mouth is filled with sharp teeth. It has glowing red eyes, and emits a deep, guttural growl.","Dragons , Bronze , Ancient , Huge"
Ancient Copper Dragon,"The Ancient Copper Dragon is a massive, serpentine dragon that is said to be as old as the mountains themselves. It is said to be immune to all forms of magic and has skin as tough as steel. It is said to be able to breathe fire hot enough to melt even the strongest of metals.","Dragons , Magic , Serpentine , Immune to magic"
Ancient Gold Dragon,"The Ancient Gold Dragon is a massive, dragon-like creature that is said to be made entirely of gold. It is said to be incredibly powerful and is said to be able to breathe fire.","Ancient , Gold , Dragon , Powerful"
Ancient Green Dragon,"The Ancient Green Dragon is a massive creature with scaly green skin and large wings. It has a long neck and tail, and its head is adorned with horns. Its eyes are glowing green, and its mouth is full of sharp teeth. It is a fearsome creature, and it is said that it is immune to fire.","Mythology , Nature , Dragons , Immunity to fire"
Ancient Red Dragon,"The Ancient Red Dragon is a massive, powerful creature that dwells in dark caves and lurks in the shadows, waiting to pounce on its unsuspecting prey. It has razor-sharp claws and teeth, and its scaly hide is tough and difficult to penetrate. This dragon is feared by all who know of its existence, and it is considered to be one of the most dangerous creatures in the world.","Ancient , Red , Dragon , Cave 1 Powerful , Dangerous , Lurking , Shadow"
Ancient Silver Dragon,"The Ancient Silver Dragon is a massive, serpentine creature with gleaming silver scales. It has a long neck and tail, and its wings are large and leathery. Its eyes are glowing red, and its mouth is full of sharp teeth. It is a fearsome creature, and it is said that it is immune to fire.","Dragons , Serpents , Fire immunity , Ancient"
Ancient White Dragon,"The Ancient White Dragon is a massive creature that towers over everything in its path. It has a long neck and tail, and its body is covered in thick white scales. Its head is adorned with a pair of large horns, and its mouth is full of sharp teeth. Its eyes are glowing red, and its breath is icy cold. It is a fearsome creature that should not be underestimated.","Ancient, Dragon, Huge, Legendary, White"
Androsphinx,"The Androsphinx is a massive creature with the body of a lion and the head of a human. It is said to be the guardian of a lost city, and is incredibly powerful. It is feared by all who know of its existence.","Ancient , Beast , Guardian , Lost"
Animated Armor,"The Animated Armor is a fearsome creature that lurks in the dark, preying on the unsuspecting. It is a fearsome opponent that is difficult to defeat, but can be overcome with perseverance and skill. This creature is fast and agile, making it a difficult target to hit, and its armor is thick and strong, making it resistant to damage.","Dark, Preying, Fearsome, Difficult, Resilient"
Ankheg,"The Ankheg is a large, six-legged creature that burrows through the ground to surprise its prey. It has a long, segmented body with a large, toothed mouth that can spit acid. Its carapace is hard and difficult to penetrate, making it a tough opponent in combat.","Monster,, Combat, , Acid, , Burrowing"
Ankylosaurus,"The Ankylosaurus is a large, heavily armored dinosaur. It is covered in thick plates of armor, and has a large club-like tail that it can use to bash enemies. It is a slow but powerful creature, and is very difficult to kill.","Dinosaur , Armor , Club-like tail , Slow but powerful"
Apep,"Apep is a giant snake monster that lurks in the dark depths of the game world. It is a fearsome creature that can kill with its poisonous fangs, and it is said that its very presence can drain the life force from those nearby.","Monsters , Darkness , Danger , Fear"
Archmage,The Archmage is a powerful sorcerer that wields dark magic. It is a fearsome opponent that can easily dispatch its enemies with its powerful spells.,"Powerful sorcerer , Dark magic , Fearsome opponent , Easily dispatches enemies"
Assassin,"The Assassin is a humanoid creature with long, sharp claws. It is incredibly agile and quick, making it a difficult opponent to fight. It is also proficient in using poison, making it even more dangerous.","Assassin , Deadly Assassin , Assassin's Creed , Assassin's Guild"
Awakened Shrub,"The Awakened Shrub is a small, dark creature that lurks in the shadows, waiting to ambush its unsuspecting prey. It has long, sharp claws that it uses to rend and tear flesh, and its teeth are sharp as blades. It is a cunning and vicious predator, and will stop at nothing to devour its prey.","Cunning and vicious predator , Lurking in the shadows , Sharp claws and teeth , Small, dark creature"
Awakened Tree,"The Awakened Tree is a massive, ancient tree that has been corrupted by dark forces. It is covered in dark vines and has large, sharp thorns protruding from its trunk. Its branches are twisted and gnarled, and its leaves are blackened and withered. It emits a low, menacing growl, and its eyes glow red with malevolent intent.","Evil , Corruption , Dark Forces , Massive"
Axe Beak,"The Axe Beak is a large, flightless bird that attacks with its powerful beak. It is a fearsome opponent that can easily kill an unprepared adventurer.","Animal , Bird , Fearsome , Powerful"
Azerothian Lich,"The Azerothian Lich is a powerful undead creature that can be found in the dark corners of Lordran. This fearsome creature is clad in ancient armor and wields a deadly scythe. It is said that the Azerothian Lich is a powerful sorcerer, and it is rumored that it can raise the dead.","Undead , Lordran , Dark corners , Powerful"
Baboon,"The Baboon is a small, monkey-like creature that is found in the dark depths of the forest. It is a fast and agile creature that can easily dodge attacks. It has sharp claws and teeth that can deal significant damage to an opponent.","Dark and Dangerous , Fearsome and Powerful , Intelligent and Cunning , Quick and Agile"
Badger,"The Badger is a small, rodent-like creature that scurries around in the dark, looking for small prey to devour. It is quick and agile, making it hard for larger creatures to catch, and its sharp teeth can deliver a painful bite.","Cunning , Survival , Dark , Small"
Balor,"The Balor is a fearsome creature that lurks in the shadows, waiting to strike at its unsuspecting prey. It is a large, muscular creature with black fur and red eyes, and is armed with sharp claws and teeth.","Horror , Mythology , Religion , Violence"
Bandit,"The Bandit is a humanoid creature that is covered in ragged clothing. It has a wild, almost feral look in its eyes, and its mouth is full of sharp teeth. It wields a crude weapon in each hand, and seems to be quite skilled in using them. It is a dangerous opponent, and will not hesitate to attack any living creature it comes across.","Danger,, Survival, , Violence, , Outlaws"
Bandit Captain,The Bandit Captain is a humanoid monster that is covered in armor from head to toe. It wields a large sword in one hand and a shield in the other. The Bandit Captain is a very aggressive monster that will charge at the player and try to hack them to pieces with its sword.,"Aggressive , Armor , Sword , Shield"
Banshee,"The Banshee is a fearsome creature that lurks in the shadows, waiting to pounce on its unsuspecting prey. It has long, sharp claws that can rend flesh from bone, and a mouth full of sharp teeth that can tear through flesh like paper. It moves with lightning speed, and its howls can paralyze even the bravest of warriors.","Horror , Mythology , Female figure , Fear"
Barbed Devil,"The Barbed Devil is a fearsome creature that lurks in the dark, waiting to pounce on its unsuspecting prey. It is a large, muscular creature with sharp claws and teeth, and barbed quills running down its back. It is feared for its strength and ferocity, and is known to be able to rip a person apart with its bare hands.","Monsters , Dark , Fear , Strength"
Basilisk,"The Basilisk is a large, snake-like creature that can petrify its victims with a glance. It is a feared predator of the dark depths of the world, and few who encounter it live to tell the tale.","Monsters , Fear , Darkness , Prey"
Bat,"The Bat is a small, flying creature that attacks by swooping down on its prey. It is relatively weak, but can be a nuisance in large numbers.","Flying creature , nuisance , small , weak"
Bearded Devil,"The Bearded Devil is a fearsome creature that lurks in the dark, preying on the unsuspecting. It is a large, muscular creature with a long, beard-like mane that covers its face. It has large, sharp claws that it uses to rend its victims apart. It is a fearsome opponent that should not be underestimated.","Monsters , Dark , Prey , Fearsome"
Behir,"The Behir is a massive, serpentine creature with multiple legs and barbed tail. It is covered in tough, scaly skin that is difficult to penetrate. It is an aggressive predator that will attack anything that moves. It is fast and agile, making it difficult to hit. It is also resistant to magic, making it a difficult foe for spellcasters.","Monsters , Combat , Agility , Magic"
Berserker,"The Berserker is a massive, hulking creature that towers over most other enemies in the game. It is incredibly strong, and can deal massive amounts of damage with its huge fists. It is very slow, however, and can be easily outmaneuvered by nimble opponents.","Strength , Rage , Ferocity , Brutality"
Black Bear,"The Black Bear is a large, aggressive monster that roams the dark forests of Lordran. It is a fearsome opponent, capable of tearing apart its prey with its powerful claws. It is also known to be highly intelligent, and has been known to ambush unwary travellers.","Animal , Forest , Monster , Dark"
Black Dragon Wyrmling,"This small black dragon wyrmling is barely bigger than a human child. It has a long, sinuous body with small wings that allow it to glide short distances. It has sharp claws and teeth, and its tail is tipped with a poisonous stinger. It is intelligent and cunning, and will often use trickery to get the upper hand on its opponents.","Cunning , Intelligence , Trickery , Small size"
Black Pudding,"The Black Pudding is a large, amorphous creature that is black and slimy in appearance. It is hostile and will attack anything that comes near it. It is difficult to kill due to its lack of a physical form, but can be damaged by fire and magic.","Horror , Slippery , Amorphous , Hostile"
Blink Dog,"This monster is a large, black dog with red eyes. It is very fast and agile, and can teleport short distances. It is aggressive and will attack anything that it perceives as a threat.","Teleportation , Aggressive , Fast , Red eyes"
Blood Hawk,"The Blood Hawk is a large, predatory bird that is found in the dark, dank caves of the world. It has red eyes and a hooked beak, and its feathers are stained with blood. It is a fearsome creature that will attack anything that moves, and its sharp claws can rend flesh from bone.","Dark and Dangerous , Blood and Gore , Cave Creatures , Survival"
Blue Dragon Wyrmling,"This small, spindly creature has a long, sinuous body that is covered in shimmering blue scales. It has a pair of large, leathery wings that it uses to glide through the air, and a long, barbed tail that it uses to lash out at its enemies. It has a pair of small, black eyes that gleam with intelligence, and a mouth full of sharp teeth.","Loyalty , Intelligence , Stealth , Gliding"
Boar,"The Boar is a large, aggressive creature that dwells in dark caves and forests. It is covered in thick, bristly fur that protects it from attacks, and its sharp tusks are deadly weapons. This monster is feared by many travelers, as it is known to charge without warning and can easily kill an unprepared victim.","Animal , Cave , Dark , Fur"
Bone Devil,"The Bone Devil is a skeletal demon that wields a large scythe. It is a fearsome opponent that can slice through flesh and bone with ease. It is a creature of the night that preys on the living, and is especially dangerous in groups.","Horror, Demon , Skeletal , Night"
Brass Dragon Wyrmling,"This Brass Dragon Wyrmling would be a fearsome opponent in Dark Souls, with its large size and powerful attacks. It would likely be a difficult boss battle, requiring strategy and careful timing to defeat. This dragon would likely have a variety of fire-based attacks, making it a dangerous foe for any would-be adventurer.","Dark Souls , Dragon , Boss , Fierce"
Bronze Dragon Wyrmling,"This monster would be a small, young dragon that is covered in bronze scales. It would be a ferocious creature that would breathe fire and fly around the battlefield. Players would need to be careful when fighting this creature, as its fire breath could easily incinerate them.","Fire , Flying , Small , Young"
Brown Bear,"The Brown Bear is a large, furry creature that lumbers around on all fours. It has a large, round head with small, beady eyes, and a wide mouth filled with sharp teeth. Its fur is brown and matted, and its body is covered in scars. It is a fearsome creature that will attack anything that crosses its path.","Fearsome , Lumbering , Large , Round head"
Bugbear,"The Bugbear is a large, furry creature that resembles a cross between a bear and a dog. It is covered in shaggy, brown fur, and has a long snout. It is an aggressive creature that will attack anything that it perceives as a threat.","Aggressive , Furry , Large , Cross between a bear and a dog"
Bulette,"The Bulette is a massive, burrowing creature that attacks by leaping out of the ground and slamming into its prey. It is covered in thick, armored plates, making it nearly impervious to damage. The Bulette is a fearsome opponent that should be avoided if possible.","Beast , Burrowing , Huge , Melee"
Camelopardalis,"This monster would be a large, four-legged creature with a long neck and spots all over its body. It would be a herbivore that roams the plains, and its main method of attack would be to trample its opponents. It would be a tough opponent, but ultimately defeatable.","Desert , Animal , Plains , Herbivore"
Catoblepas,"The Catoblepas is a massive, hulking beast, covered in thick, shaggy fur. It has a large, bovine head, with two long, curved horns. Its eyes are small and beady, and its mouth is filled with sharp teeth. It has four short legs, each ending in a sharp hoof. It is a dark brown color, with a lighter brown mane.
This massive creature is slow and lumber","Beast , Hulking , Fur , Curved horns"
Centaur,"The Centaur is a large, four-legged creature with the torso and head of a man. It is heavily muscled and its fur is matted with blood and dirt. It wields a large, crudely made club in one hand and a crudely made spear in the other. It is a fearsome opponent and will charge at the player, swinging its weapons wildly.","Animalistic , Combat , Ferocity , Nature"
Chain Devil,"The Chain Devil is a fearsome creature that lurks in the dark corners of Lordran. It is a humanoid creature with a long chain wrapped around its body. The Chain Devil is known for its quick and deadly attacks, as well as its ability to teleport.","Horror , Dark , Demons , Teleportation"
Chimera,"The Chimera is a fearsome creature with the head of a lion, the body of a goat, and the tail of a serpent. It is said to be immune to fire, and its breath is said to be able to turn men into stone.","Mythological creature , Immunity to fire , Breath that can turn men into stone , Fearsome"
Chuul,"The Chuul is a large, lobster-like creature that dwells in the dark depths of the ocean. It is a fearsome predator, using its powerful claws to rend and tear its prey. The Chuul is also known to be highly intelligent, and is often used by evil wizards as a guard or bodyguard.","Monsters , The ocean , Intelligence , Evil"
Clay Golem,"The Clay Golem is a massive creature made entirely out of clay. It is slow and ponderous, but its enormous size and strength make it a formidable opponent. It attacks by slamming its fists into the ground, or by picking up and throwing large rocks.","Clay Golem , Giant , Strength , Slow"
Cloaker,"The Cloaker is a fearsome and deadly creature that lurks in the shadows, waiting to pounce on its unsuspecting prey. It is a fast and agile creature that can easily take down its prey with its sharp claws and teeth. The Cloaker is a feared creature by all who know of its existence.","Fearful , Fast , Agile , Deadly"
Cloud Giant,"The Cloud Giant is a massive creature that towers over everything else in the game. It is incredibly slow and sluggish, but its attacks are incredibly powerful and can easily crush players. It is immune to most forms of damage, and can only be killed by using a special weapon or by using a very powerful magic attack.","Giant , Slow , Powerful , Immune to most damage"
Cockatrice,The Cockatrice is a monster that can be found in the game Dark Souls. It is a large bird-like creature that has a long neck and a beak that can deliver a powerful shock. It is also able to spit a corrosive acid that can melt away flesh.,"Danger , Horror , Nature , Strength"
Commoner,"The Commoner is a small, rat-like creature that scurries around in the dark, looking for food. It is not very strong, but can be dangerous in large numbers.","Survival , Dark , Scurrying , Small"
Constrictor Snake,This monster would be a giant snake that would wrap itself around its prey and crush them. It would have razor sharp teeth and would be very difficult to kill.,"Survival , Strength , Size , Fear"
Copper Dragon Wyrmling,"This small dragon wyrmling is covered in bright copper scales. It has a long neck and tail, and small wings that allow it to glide short distances. It is a young dragon, but already shows signs of the power it will one day wield.","Power , Courage , Loyalty , Independence"
Couatl,"This monster would be a flying creature with large, brightly-colored wings. It would have a long, snake-like body and a human-like head with horns. It would be a powerful magic user, able to shoot fireballs and other spells from its mouth.","Magic , Dragons , Religion , Adventure"
Crabman,"This monster would be a humanoid crab creature, likely with a large shell on its back. It would be aggressive and would likely attack with its claws. It would be a tough enemy to defeat, but would be vulnerable to fire.","Crabman aggressive, tough, vulnerable to fire , Crabman humanoid crab creature, large shell on back, aggressive , Crabman creature that lives in the sea, crab-like, aggressive , Crabman creature that lives in the sea, aggressive"
