Name,Descriptions,Keywords
Gold Dragon Wyrmling,"This monster is a small, gold-colored dragon. It has a long, slender body and small wings. Its head is adorned with a pair of horns, and its tail is long and thin. It is a young dragon, and is not yet fully grown.","Dragons , Gold , Dragonlings , Small"
Gorgon,"The Gorgon is a massive, serpentine creature with a head of writhing snakes instead of hair. It has a pair of large, leathery wings, and its body is covered in thick scales. It is incredibly fast and agile, and its venomous fangs can paralyze or even kill its prey.","Monsters , Fear , Transformation , Mythology"
Gray Ooze,"The Gray Ooze is a large, amorphous blob of black goo. It is slow and sluggish, but can spit acid at its enemies. It is weak to fire and lightning.","Sluggishness , Acid , Weakness to fire and lightning , Amorphous"
Green Dragon Wyrmling,"This monster would be a small, young dragon that is mostly green in color. It would be a fairly weak opponent, but could still pose a threat if underestimated. It would likely be found in an early area of the game, serving as a introduction to dragon-type enemies.","Nature, Dragons , Weakness , Introduction"
Green Hag,"The Green Hag is a monster that lurks in the dark, waiting to ambush its unsuspecting prey. It is a fearsome creature, with sharp claws and teeth that can rend flesh from bone. It is said that the Green Hag is able to transform itself into a beautiful woman, lure men into its clutches, and then devour them.","Monsters , Dark , Fearsome , Luring"
Grick,"The Grick is a large, worm-like creature that lurks in the dark depths of the world. It is a fearsome predator, capable of devouring entire creatures with ease. It is feared by all who know of its existence.","Monsters , Darkness , Prey , Fear"
Griffon,"The Griffon is a large, predatory bird that dwells in the mountains. It has a wingspan of over 20 feet, and its feathers are black and white. Its talons are sharp and its beak is curved, allowing it to rip flesh from its prey. The Griffon is a fearsome creature, and it is said that only the bravest of knights dare to face it.","Mountain dweller , Prey on other animals , Sharp claws and beak , Brave"
Grimlock,"The Grimlock is a fearsome creature that lurks in the dark corners of Lordran. It is a large, hulking beast with sharp claws and teeth that can rend flesh from bone. It is feared by many for its ferocity and strength, and it is said that only the bravest of warriors can hope to defeat one.","Monster , Dark , Violence , Fear"
Guardian of the Abyss,"This monster would be a large, hulking creature, likely humanoid in shape. It would be heavily armored, with large, spiked plates of metal covering its body. It would carry a huge, two-handed weapon, which it would use to crush its enemies. It would be a fearsome foe, difficult to defeat.","Dark, dangerous, fearsome , Horror, abyss, creature , Strength, power, strength , Protection, guardian, fortress"
Guardian Naga,"The Guardian Naga is a massive, dragon-like creature that lurks in the dark depths of Lordran. It is a fearsome opponent, armed with razor-sharp claws and teeth, and a tail that can crush and impale its enemies. The Guardian Naga is also able to spit a corrosive acid that can melt flesh and bone.","Dark, Dragon-like creature , Fearsome opponent , Sharp claws and teeth , Spits corrosive acid"
Gynosphinx,The Gynosphinx is a massive creature with the head of a woman and the body of a lion. It is said to be incredibly intelligent and can speak any language. It is also said to be very powerful and is capable of using powerful magic.,"Magical creature , Intelligence , Powerful magic , Gender"
Half-Red Dragon Veteran,"This monster would be a fearsome opponent, covered in red scales with sharp claws and teeth. It would be able to breathe fire, and would be extremely difficult to defeat.","Fearsome , Powerful , Difficult , Battling"
Harpy,"The Harpy is a monster that lurks in the dark, waiting to pounce on its unsuspecting prey. It has razor sharp claws and teeth, and its wings are covered in barbs that can slice through flesh. It is a fearsome creature that should be avoided at all costs.","Horror , Female Monster , Dark and Dangerous , Prey"
Hawk man,"This monster would be a humanoid creature with the head of a hawk. It would be incredibly agile, and would attack by swooping down on its prey with its sharp talons. It would be a fearsome opponent, and would be difficult to defeat due to its speed and agility.","Animalistic , Combat , Fearful , Powerful"
Hell Hound,"The Hell Hound is a fearsome creature that lurks in the dark, preying on unsuspecting victims. It is a large, muscular dog with black fur and red eyes that glow with an inner fire. It has sharp teeth and claws that can rend flesh from bone. It is a fearsome opponent that should be avoided if possible.","Fearsome , Preying , Darkness , Violence"
Hezrou,"This monster would be a large, demonic creature with red skin and horns. It would be incredibly strong and would be able to shoot fire from its mouth.","Demons , Fire , Strength , Large"
Hill Giant,"The Hill Giant is a massive creature that towers over most other enemies in the game. It is incredibly strong, and can easily crush players with its fists or stomp them into the ground. It is slow and lumbering, but can be very dangerous if players are not careful.","Strength , Size , Danger , Lumber"
Hippogriff,"The Hippogriff is a large, predatory creature that dwells in the dark depths of the forest. It is a fearsome beast, with razor sharp claws and teeth, and a powerful wingspan that allows it to soar through the air with ease. The Hippogriff is a dangerous foe, and should not be underestimated.","Animal , Dark , Forest , Foe"
Hobgoblin,"The Hobgoblin is a small, humanoid creature that is covered in shaggy fur. It has a long snout, and its eyes glow a bright red. It is armed with a crude weapon, and it is very agile. It is also very aggressive, and will attack anything that it perceives as a threat.","Monsters , Combat , Agility , Aggression"
Homunculus,"The Homunculus is a small, humanoid creature with a large, bulbous head. It has no eyes, and its mouth is filled with sharp teeth. Its body is covered in thick, dark fur, and it has long, claw-like fingers. It is a fast and agile creature, and is known for its ferocity in battle.","Horror, Mythology , Monsters , Strange"
Horned Devil,"This monster would be a fearsome and powerful foe, likely found deep in the darkest depths of the game world. It would be a hulking creature, covered in thick armor and armed with deadly horns and claws. Players would need to be careful when engaging this enemy, as its attacks would be incredibly powerful and could easily kill even the most experienced adventurers.","Fearsome , Powerful , Dark , Dangerous"
Hunter Shark,"The Hunter Shark is a massive, predatory fish that lurks in the dark depths of the ocean. It is covered in razor-sharp teeth, and its powerful tail can snap a man in half. It is a fearsome creature that few have ever survived encountering.","Predator , Dark depths , Sharp teeth , Powerful tail"
Hydra,"The Hydra is a massive, multi-headed creature that dwells in dark caves and lurks in the shadows, ready to pounce on its unsuspecting prey. It is a fearsome opponent, with razor-sharp claws and teeth, and a long, snake-like body that is covered in thick scales. The Hydra is also able to spit poisonous venom, which can paralyze or even kill its victims.","Monsters , Danger , Fear , Revenge"
Hyena,"The Hyena is a small, fast moving creature that attacks by biting and clawing at its prey. It is difficult to hit due to its size and speed, and can be quite dangerous in groups.","Animal , Fast , Dangerous , Prey"
Ice Devil,"The Ice Devil is a fearsome creature that lurks in the coldest parts of the world, preying on anything that crosses its path. It is a large, hulking creature, covered in thick white fur, with a long snout and razor-sharp teeth. It has icy blue eyes that seem to pierce your soul, and it is said that just looking into them can freeze your blood. It is a powerful creature, able to shoot blasts of freezing cold from its","Monsters , Cold , Fear , Survival"
Ice Mephit,"This monster would be a small, humanoid creature made entirely of ice. It would be weak and fragile, but would be able to shoot icy blasts from its hands that could freeze opponents.","Cold , Ice , Frozen , Snow"
Imp,"The Imp is a small, humanoid creature with leathery skin and a long tail. It has sharp claws and teeth, and glowing red eyes. It is fast and agile, and attacks by swiping at its opponents with its claws.","Evil , Trickery , Speed , Agility"
Invisible Stalker,"The Invisible Stalker is a fearsome and deadly foe that is nearly impossible to see. It is said that this creature is made of pure shadow, and it is able to move through the darkness without making a sound. It is incredibly fast and agile, and it can strike from the shadows without warning. This creature is incredibly difficult to defeat, and it is said that only the most skilled of warriors have any hope of defeating it.","Stealth, Shadow , Fast , Agile"
Iron Golem,"The Iron Golem is a massive, hulking creature made entirely of iron. It is incredibly strong and durable, making it a fearsome opponent in battle. It is slow and ponderous, but its attacks are devastating and can crush even the strongest of foes.","Strength , Iron , Golem , Battle"
Jackal,"The Jackal is a small, wolf-like creature that is found in the dark areas of the game world. It is a fast and agile creature that can easily take down an unsuspecting player.","Predator , Stealth , Agility , Fast"
Killer Whale,"The Killer Whale is a massive creature that lurks in the depths of the ocean, waiting to devour any hapless sailors that cross its path. It is a fearsome opponent, with powerful jaws and razor-sharp teeth that can easily tear through flesh and bone.","Animal , Marine , Sea , Threat"
Knight of the Abyss,"The Knight of the Abyss is a fearsome creature that lurks in the dark depths of Lordran. This monstrous being is clad in black armor, and wields a greatsword that seems to absorb the light around it. The Knight of the Abyss is a fearsome foe, and will stop at nothing to claim the souls of those who cross its path.","Dark , Horror , Violence , Souls"
Kobold,"The Kobold is a small, rat-like creature that scurries around in the dark, looking for small prey to devour. It is not a particularly dangerous creature, but can be a nuisance if it gets too close.","scavengers , small prey , nuisance , dark"
Kraken,"The Kraken is a massive sea creature with tentacles that can reach up to 30 feet long. It has a large, toothed mouth and eyes that glow red in the dark. Its body is covered in a tough, scaly skin that is difficult to penetrate.","Monsters , The ocean , Tentacles , Red eyes"
Lamia,"Lamia is a monster that lurks in the dark, waiting to strike at its unsuspecting prey. It is a fearsome creature, with sharp claws and teeth that can rend flesh from bone. Lamia is also said to be able to hypnotize its victims, making them easy prey for its deadly attacks.","Dark and Dangerous , Hypnotism , Fearsome Creatures , Prey"
Lemure,"The Lemure is a small, humanoid creature with pale white skin. It has large, black eyes, and a mouth full of sharp teeth. It is clad in tattered rags, and wields a small knife in each hand. It is a weak creature, but can be dangerous in large numbers.","Horror , Monster , Creature , Weak"
Lich,The Lich is a powerful undead creature that is often found guarding ancient tombs and ruins. It is a fearsome opponent that is able to cast powerful spells and drain the life force from its victims.,"Undead , Magic , Ancient ruins , Powerful spells"
Lion,"The Lion is a massive, powerful creature that roams the dark, dank depths of Lordran. It is a fearsome opponent, capable of tearing apart even the most hardy of adventurers with its powerful claws and teeth. Beware its ferocious roar, which can paralyze even the bravest of souls.","Courage , Strength , Pride , The Dark"
Lizard man,"The Lizardman is a large, reptilian creature that is covered in scaly armor. It has a long tail and a toothy maw, and wields a large club in its hands. It is a fearsome opponent that is difficult to defeat.","Monster , Combat , Strength , Reptilian"
Lizardfolk,"The Lizardfolk is a monster that lurks in the dark, preying on unsuspecting victims. It is a fearsome creature, with sharp claws and teeth that can rend flesh from bone. It is also a cunning adversary, using its tail to trip up its prey and then striking when they are vulnerable.","Dark, Prey, Savage, Terrifying"
Mage,"The Mage is a humanoid creature with pale skin and dark, sunken eyes. It wears tattered robes and carries a staff adorned with strange symbols. The Mage is a powerful spellcaster, able to unleash devastating spells that can incinerate foes or crush them with powerful force. It is a cunning and dangerous opponent, and should not be underestimated.","Arcane, magic, powerful, spellcasting"
Magma Mephit,"A small, fiery creature that dwells in lava. It is weak and easily defeated, but can cause burns with its touch.","Lava, Inflammation , Burning , Pain"
Magmin,"This monster would be a small, fiery creature that would dart around the battlefield, setting anything it touches ablaze. It would be a difficult foe to take down, as it would be constantly moving and attacking with its fiery breath.","Fire , Speed , Flaming , Difficult"
Mammoth,"The Mammoth is a massive, hulking creature that towers over most other enemies in the game. It is slow and lumbering, but its attacks are incredibly powerful and can easily crush most players. It is covered in thick fur, and its tusks are sharp and deadly. It is a fearsome opponent, but can be defeated with careful planning and quick reflexes.","Massive , Hulking , Powerful , Slow"
Manticore,"The Manticore is a fearsome creature with the body of a lion, the wings of a dragon, and the tail of a scorpion. It is a powerful foe that can dish out massive damage with its claws, teeth, and tail.","Fearsome , Powerful , Deadly , Savage"
Marilith,"This monster would be a large, snake-like creature with multiple arms and legs. It would be very fast and agile, and would be able to attack with all of its limbs simultaneously. It would be extremely difficult to defeat, and would likely require multiple players to take it down.","Powerful , Fast , Agile , Difficult to defeat"
Mastiff,"The Mastiff is a large, powerful dog-like creature that roams the dark, dank corridors of Lordran. It is a fearsome opponent, capable of tearing apart even the most well-armored warrior with its sharp teeth and powerful claws. Beware its deadly charge, as it can easily bowl over even the most experienced fighter.","Loyalty , Strength , Protection , Dark"
Medusa,"A monstrous beast with the head of a writhing mass of snakes instead of a human face. Her gaze is said to turn men to stone, and her body is covered in sharp, poisonous blades. She is a fearsome opponent in battle, and only the most brave or foolhardy would dare to face her.","Monsters , Combat , Fear , Courage"
Merfolk,The Merfolk are a race of creatures that live in the water. They are humanoid in appearance and have the upper body of a human and the lower body of a fish. They are known to be very agile and fast swimmers. They are also known to be very aggressive and will attack anything that comes near them.,"aquatic , fish , agile , aggressive"
Merrow,The Merrow is a monster that lurks in the dark depths of the ocean. It is a fearsome creature with razor sharp teeth and tentacles that can drag its prey to a watery grave.,"Dark, underwater, fear, danger, creature"
Mimic,"The Mimic is a monster that disguises itself as a treasure chest in order to lure in unsuspecting victims. When a victim approaches, the Mimic will spring to life and attack with its powerful claws and teeth. The Mimic is a dangerous foe that should be avoided if possible.","Monsters , Danger , Luring , Disguise"
Minotaur,"The Minotaur is a large, hulking creature with the head of a bull and the body of a man. It is incredibly strong and ferocious, and is known for charging at its enemies with reckless abandon. It is a fearsome opponent, and one that should not be underestimated.","Fierce, Powerful, Dangerous, Unpredictable , Strength, Courage, Endurance, Aggression , Nature, Mythology, Monsters, Beast , Battle, War, Violence, Battlefields"
Minotaur Skeleton,"This monster would be a large, skeletal creature with horns protruding from its head. It would be slow and lumbering, but would deal a large amount of damage with its attacks. It would be resistant to physical damage, but vulnerable to fire.","skeletal, large , slow , lumbering"
Mule,"The Mule is a large, four-legged creature that resembles a cross between a horse and a donkey. It is covered in shaggy brown fur, and has a long, thick tail. It has a large, square head, and its eyes are glowing red. It has two large, curved horns that protrude from its head. Its hooves are black, and it has a long, black mane. It is a fearsome creature, and is known to attack anything","Animal , Crossbreed , Fearsome , Horns"
Mummy,"The Mummy is a monster that lurks in the dark, waiting to ambush its unsuspecting prey. It is a fearsome creature, wrapped in bandages and armed with deadly claws. It is fast and agile, and can quickly close the distance between it and its prey. The Mummy is a dangerous foe, and should not be underestimated.","Horror , Undead , Monster , Dark"
Mummy Lord,"The Mummy Lord is a powerful undead creature that lurks in the dark corners of Lordran. It is a fearsome opponent that is difficult to defeat, but rewards those who are able to do so with powerful loot.","Undead , Dark , Horror , Loot"
Nalfeshnee,"The Nalfeshnee is a large, demonic creature with a body that is mostly humanoid, although it has a large, bestial head with a long, snake-like tongue. It has large, leathery wings, and its body is covered in thick, black fur. It wields a large, spiked club in one hand, and has a long, barbed tail.","Evil, demon, monster, dark, night , Religion, faith, god, divine, holy , Violence, aggression, war, battle, bloodshed , Strength, power, might, mightiest"
Night Hag,"The Night Hag is a fearsome creature that lurks in the shadows, preying on the unsuspecting. She has a skeletal body with long, sharp claws and a face that is half-human, half-demonic. Her eyes glow red with hunger and her mouth is full of sharp teeth. She is clad in tattered black robes and moves with a sinister grace. She is a fearsome opponent who will stop at nothing to devour her prey.","Horror, Darkness , Monsters , Fear"
Nightmare of Mensis,"This monster would be a fearsome creature that would lurk in the dark corners of the world, waiting to pounce on unsuspecting victims. It would be a fast and agile creature, making it difficult to hit, and would deal heavy damage with its claws and teeth.","Nightmare , Dark , Fearsome , Dangerous"
Noble Knight,"The 'Noble Knight' is a fearsome creature that lurks in the shadows, preying on the unsuspecting. It is a master of stealth and deception, and is known for its quick and deadly attacks. This creature is feared by all who know of its existence, and is considered to be one of the most dangerous creatures in the world.","Stealth , Deception , Prey , Dangerous"
Nothic,"The Nothic is a fearsome creature that lurks in the dark, preying on unsuspecting victims. It has long, sharp claws that it uses to rend flesh, and its eyes glow a eerie green in the darkness. It is a fearsome opponent that should not be underestimated.","Monsters , Prey , Fear , Darkness"
Ochre Jelly,"The Ochre Jelly is a large, amorphous creature that is covered in a thick, slimy substance. It is a slow moving creature that lumbers towards its prey, and once it is close enough, it will lash out with its long, tentacle-like appendages to try and ensnare its victim. The Ochre Jelly is a dangerous foe, as its slimy body is highly acidic, and it can easily dissolve flesh and bone with its corros","Slippery, slimy, dangerous , Tentacle-like, lashing, acidic , Prey, lurching, slow , Amorphous, large, slow"
Octopus,"This monster would be a large, tentacled creature that would attack by lashing out with its tentacles or by spraying a stream of ink at its enemies. It would be a fearsome opponent that would be difficult to defeat.","Tentacle Monster , Ink Monster , Fearful Monster , Difficult Monster"
Ogre,"The Ogre is a massive, brutish creature that lumbers around slowly, but is capable of dealing massive damage with its huge club. It is a fearsome opponent, and will often charge at players, swinging its club wildly.","brute force,, slow and steady, , huge damage, , fearsome opponent"
Ogre Zombie,"The 'Ogre Zombie' is a large, undead creature that lumbers around slowly, but is capable of dealing huge amounts of damage with its powerful attacks. It is often found guarding treasure or important locations, and can be a difficult foe to defeat.","Undead , Monster , Combat , Treasure"
Oni,"The Oni is a large, hulking creature that is covered in thick, black fur. It has long, sharp claws and teeth, and its eyes glow red with fury. It is a fearsome opponent that will stop at nothing to destroy its enemies.","Evil , Violence , Strength , Terror"
Orc,"The Orc is a large, brutish creature that is covered in thick armor. It wields a large axe in one hand, and a shield in the other. It is a slow, but powerful enemy that can deal a lot of damage if it hits you.","Orc , Brutality , Strength , Armor"
Otyugh,"The Otyugh is a large, slug-like creature that dwells in dark, dank places. It has a large, toothed mouth and several tentacles that it uses to grab and devour its prey. The Otyugh is a feared creature by many, as it is known to be quite difficult to kill.","Monsters , Fear , Slugs , Dank"
Owl beast,"The Owlbeast is a fearsome creature that lurks in the dark, preying on unsuspecting victims. It has large, sharp claws that can rend flesh, and a beak that can pierce bone. Its feathers are black as night, and its eyes glow a eerie green. It is a fearsome opponent, and one that should not be underestimated.","Dark and mysterious , Prey on the weak , Fearsome and deadly , Nightmarish"
Owlbear,"The Owlbear is a large, furry creature with the head of an owl and the body of a bear. It is a fierce predator that dwells in dark forests and caves, and is known to attack anything that enters its territory. It is a dangerous foe, but can be defeated if one is careful and prepared.","Fearsome , Savage , Dangerous , Prey"
Panther,"This monster would be a large, black panther with razor-sharp claws and teeth. It would be incredibly fast and agile, making it a difficult foe to defeat.","Power , Strength , Speed , Agility"
Pegasus,"This monster would be a flying horse with wings made of pure darkness. It would have red eyes and sharp teeth. It would be fast and agile, making it hard to hit. It would also be able to breathe fire.","Mythology , Magic , Adventure , Strength"
Phase Spider,"The Phase Spider is a fearsome creature that lurks in the dark, waiting to ambush its prey. It is a large spider with a black carapace and red eyes, and it is able to phase in and out of our reality, making it difficult to hit. When it attacks, it will lunge at its victim with its sharp fangs, injecting them with a deadly venom.","Dark and Dangerous , Stealth and Ambush , Spider-like Creature , Deadly Venom"
Pit Fiend,"The Pit Fiend is a massive, demonic creature that dwells in the dark depths of the underworld. It is a fearsome opponent, armed with powerful claws and teeth that can rend flesh and bone alike. It is also surrounded by a swirling aura of darkness that can drain the life from its victims.","Evil , Underworld , Darkness , Demonic"
Planetar,"This monster would be a giant, angelic creature with wings made of pure light. It would carry a sword and shield made of the same light, and its eyes would burn with righteous fury. It would be a powerful foe, but one that could be overcome with perseverance and skill.","Angelic , Divine , Light , Powerful"
Plesiosaurus,"This monster would be a large, water-dwelling creature with a long neck and tail. It would be a fearsome opponent, using its powerful tail to lash out at enemies and its long neck to reach them from a distance.","aquatic , prehistoric , fearsome , long"
Poisonous Snake,"This monster would be a small, fast-moving creature that would deal poison damage with its bites. It would likely be found in areas with high grass or other hiding places, and could be difficult to spot until it was too late. Players would need to be careful when exploring such areas, and would need to have a way to cure poison if they wanted to avoid taking significant damage from this creature.","Poisonous , Fast , Small , Difficult to spot"
Polar Bear,"The Polar Bear is a massive creature that towers over most other enemies in the game. It is covered in thick white fur that protects it from the cold, and its massive claws can easily rend flesh from bone. It is a slow, but powerful enemy that can easily overwhelm unprepared players.","Arctic , Animal , Environment , Survival"
Pony,"This monster would be a small, horse-like creature that would be very fast and agile. It would have sharp teeth and claws that could deal a lot of damage.","Animal , Beast , Fable , Myth"
Priest of Filianore,"This monster would be a humanoid creature, most likely clad in religious robes. It would be a powerful enemy, able to use powerful magic and healing abilities.","Religion , Healing , Magic , Powerful"
