Name,Descriptions,Keywords
Crocodile,"The Crocodile is a large, reptilian creature that lurks in the swamps and marshes of Lordran. It is a fearsome predator, armed with sharp teeth and a powerful tail that can crush its prey. The Crocodile is also covered in tough scales that offer protection from most weapons.","Fearsome predator , Tough scales , Swamps and marshes , Lordran"
Cult Fanatic,The Cult Fanatic is a monster that is encountered in the game Dark Souls. It is a humanoid creature that is clad in tattered robes and wields a scythe. It is a dangerous opponent that can deal heavy damage with its weapon.,"Cult Fanatic , Religion , Violence , Death"
Cultist,"The Cultist is a humanoid monster that is heavily mutated and deformed. Its body is covered in tumors and growths, and its eyes are glowing white orbs. It wields a crude weapon in each hand, and its mouth is full of sharp teeth. It is a fearsome opponent that will stop at nothing to achieve its goals.","Horror , Madness , Evil , Mutilation"
Cyclops,"The Cyclops is a massive, one-eyed creature that dwells in dark caves and lurks in the shadows, ready to pounce on its unsuspecting prey. It is a fearsome opponent, with powerful swings of its club-like fists that can crush bones and skulls. Its single eye is its weak spot, and attacking it there can blind the Cyclops and leave it vulnerable to attack.","Monsters , Dark , Cave , Shadow"
Darkmantle,"The Darkmantle is a fearsome creature that lurks in the dark, preying on unsuspecting victims. It has a black, leathery body with long, sharp claws and teeth. Its eyes glow red in the darkness, and it has a long, barbed tail.","Horror, Prey , Darkness , Monster"
Death Dog,"The Death Dog is a fearsome creature that lurks in the shadows, waiting to pounce on its unsuspecting prey. It is a large, muscular dog with black fur and red eyes that glow with an eerie light. It has sharp teeth and claws that can rend flesh from bone, and its howls are said to be able to raise the dead.","Horror , Mythology , Religion , Survival"
Deep Gnome (Svirfneblin),"This small, wizened creature has pale white skin and large, dark eyes. It is clad in simple brown robes and carries a small sack. It moves with a quick, shuffling gait, and seems to be constantly on the lookout for danger.
This creature is a Deep Gnome, or Svirfneblin. It is a small, wizened creature with pale white skin and large, dark eyes. It is clad in simple brown robes and carries","A small sack. , It moves with a quick, shuffling gait, and seems to be constantly on the lookout for danger. , It is a member of a race of subterranean gnomes known as the Svirfneblin. , The Deep Gnome is a race of subterranean gnomes that dwell in the dark depths of the earth."
Deer,The Deer is a monster that can be found in the game Dark Souls. It is a large creature that is covered in fur and has antlers on its head. It is a peaceful creature that will not attack players unless provoked.,"Monster , Fur , Antlers , Peaceful"
Deva,"The Deva is a fearsome creature that lurks in the dark corners of the world. It is a large, muscular creature with black fur and red eyes. It has sharp claws and teeth, and is capable of tearing apart its prey with ease. The Deva is feared by all who know of its existence, and is considered to be one of the most dangerous creatures in the world.","Monsters , Religion , Dark , Fearsome"
Dire Wolf,"The Dire Wolf is a large, wolf-like creature that is found in the dark, forested areas of the game. It is a fearsome opponent that is known for its ferocity and strength. It is a dangerous foe that should not be underestimated.","Fierce , Dangerous , Strong , Dark"
Djinni,"The Djinni is a fearsome creature that lurks in the shadows, waiting to pounce on its unsuspecting prey. It has long, sharp claws that can rend flesh from bone, and a mouth full of sharp teeth that can tear through flesh like paper. It is a fast and agile creature, making it difficult to escape from once it has set its sights on you.","Fearful, Dangerous, Mysterious, Powerful , Magic, Spirits, Djinn, Enchanted, Cursed , Strength, Speed, Agility, Cunning, Stealth , Night, Darkness, Shadow, Fear"
Doppelganger,"The Doppelganger is a fearsome creature that lurks in the shadows, waiting to ambush its unsuspecting prey. It is incredibly fast and agile, and its sharp claws can easily rend flesh from bone. It is a cunning and ruthless hunter, and will stop at nothing to get its prey.","Horror , Mystery , Terror , Myth"
Draft Horse,"The Draft Horse is a massive, four-legged creature that towers over most other creatures in the game. It is covered in thick, shaggy fur that is mottled in shades of brown and black, and its eyes gleam with a feral intelligence. It is a fearsome opponent, capable of trampling foes under its hooves or goring them with its sharp horns.","War , Strength , Loyalty , Courage"
Dragon Turtle,"The Dragon Turtle is a massive creature with a hard shell covering its back. Its head is that of a dragon, and it has four legs ending in sharp claws. It is a fearsome creature that can breathe fire and crush its enemies with its powerful body.","Strength , Fire , Dragon , Monster"
Dretch,"The Dretch is a small, humanoid creature with dark, leathery skin. It has long, sharp claws and teeth, and glowing red eyes. It is fast and agile, and attacks by swiping at its opponents with its claws.","Horror , Evil , Monster , Alien"
Drider,"The Drider is a fearsome creature that lurks in the dark, waiting to pounce on its unsuspecting prey. It has eight long, spindly legs, and a long, segmented body that is covered in black fur. Its eyes glow a eerie green, and its mouth is full of sharp teeth.","Monsters , Dark , Fear , Prey"
Drow,"This Drowzee is a small, humanoid creature with tan fur. It has a long snout, and its eyes are always closed, giving it a sleepy appearance. It has two small horns on its head, and its hands and feet end in sharp claws. It has a long, thin tail that is tipped with a black sphere.","Power , Stealth , Manipulation , Sloth"
Druid,"The Druid is a monster that lurks in the shadows, waiting to ambush its unsuspecting prey. It is a fearsome creature, with sharp claws and teeth that can rend flesh from bone. It is agile and quick, making it difficult to escape from once it has set its sights on you. Beware the Druid, for it is a deadly foe.","Stealth, ambush, savage, dangerous , Nature, woodland, druid, mysticism , Animal, beast, predator, prey , Survival, wilderness, forest"
Dryad,"The Dryad is a monster that lurks in the dark forests of the world. It is a humanoid creature with the head of a deer and the body of a woman. The Dryad is a vicious creature that attacks anything that enters its territory. It is fast and agile, and its antlers are sharp enough to impale its victims. The Dryad is a feared creature by all who know of it, and it is said that its blood is poisonous.","Forest, Monster, Nature,, Deer, Humanoid, , Vicious, Fast, Agile, , Blood, Poison"
Duergar,"The Duergar are a race of dwarves that live in the dark places of the world, such as the Underdark. They are known for their skill in mining and smithing, as well as their ability to see in the dark. They are a fierce and warlike people, and are often at odds with the surface-dwelling races.","Dark, Dwarves, Mining, Smithing, Underdark , Warrior, Dwarves, Fierce, Warlike, Underdark , Stealth, Dwarves, Dark, Mines, Smelting, Underdark , Sight, Dwarves, Dark, Underdark, Mining"
Dust Mephit,"This monster would be a small, humanoid creature made of dust. It would have a face that is either blank or has a small, mouth-like opening. Its body would be covered in small, sharp spines. It would attack by either shooting small blasts of dust at its enemies, or by using its spines to slash at them.","Horror , Mythology , Nature , Survival"
Eagle,"The Eagle is a flying monster that attacks with its sharp claws and beak. It is fast and agile, making it difficult to hit. When killed, it drops its feathers, which can be used to make arrows.","Animal , Bird , Flying , Monster"
Earth Elemental,"The Earth Elemental is a massive creature made entirely of stone. It is incredibly slow and ponderous, but its massive size and strength make it a fearsome opponent. It is immune to most forms of attack, and can only be harmed by weapons that are particularly effective against stone.","Stone , Immune to most forms of attack , Slow and ponderous , Powerful"
Efreeti,"The Efreeti is a fearsome and powerful fire demon that dwells in the infernal planes of existence. It is a massive creature, standing taller than a man and twice as wide, with burning red skin and eyes that shimmer with inner flames. It wields a massive sword forged from purest adamantine, which it uses to cleave through its enemies with ease. The Efreeti is a fearsome opponent indeed, and those who face it in combat are sure to perish","Powerful , Infernal , Sword , Cleave"
Elephant Man,"The Elephant Man is a large, hulking creature that lumbers around slowly, crushing anything in its path. It is covered in thick, grey skin, and has two large tusks protruding from its mouth. It is a fearsome opponent, and is capable of inflicting serious damage with its powerful attacks.","Horror , Symbolism , Strength , Loneliness"
Elk,"The Elk is a massive creature that towers over most other monsters in the game. It is covered in thick fur that protects it from most attacks, and its antlers are sharp and deadly. It is a slow and lumbering creature, but its size and strength make it a force to be reckoned with.","Animal , Nature , Strength , Survival"
Erinyes,"The Erinyes is a fearsome creature that lurks in the shadows, waiting to pounce on its unsuspecting prey. It has sharp claws and teeth that can rend flesh from bone, and its eyes glow a eerie red in the darkness. Beware the Erinyes, for it is a deadly foe.","Fearsome , Darkness , Bloodlust , Prey"
Ettercap,"The Ettercap is a vile creature that lurks in the dark, waiting to ambush its unsuspecting prey. It has a humanoid body with the head of a spider, and it is covered in hair. It has long, sharp claws that it uses to rend its victims.","Spiders , Stealth , Hunting , Vile creature"
Ettin,"The Ettin is a massive two-headed ogre that wields a huge club in each hand. It is incredibly strong and tough, able to shrug off most attacks and deliver devastating blows with its weapons. It is also quite fast and agile for its size, making it a very dangerous opponent.","brute force,, speed, , strength, , agility"
Fire Elemental,This monster is a fearsome creature made entirely of fire. It is incredibly agile and attacks with ferocious flames that can incinerate its enemies. It is immune to fire damage and is extremely difficult to defeat.,"Fire , Elemental , Monster , Strength"
Fire Giant,The Fire Giant is a massive creature made entirely of fire. It is incredibly powerful and can easily incinerate anything that gets in its way. It is feared by all who know of its existence and is considered to be one of the most dangerous creatures in the world.,"Danger , Destruction , Fire , Gigantic"
Flameskull,This monster would be a floating skull engulfed in flames. It would attack by shooting fireballs at its enemies.,"Fire , Skull , Monster , Attack"
Flesh Golem,"The Flesh Golem is a large, shambling creature made entirely of rotting flesh. It is slow and clumsy, but its enormous size and strength make it a formidable opponent. It attacks by swinging its arms wildly, or by stomping on its victims.","Horror, Creature Feature , Undead , Gore"
Flying Snake,This monster would be a flying snake that would attack the player by flying at them and trying to bite them. It would be a fast and agile creature that would be difficult to hit.,"Flying , Snake , Fast , Agile"
Flying Sword,This monster would be a flying sword that would attack the player by flying at them and trying to slice them with its blade. It would be a fast and agile enemy that would be difficult to hit.,"Flying , Sword , Attack , Agility"
Frog Prince,The Frog Prince is a monster that can be found in the game Dark Souls. It is a large frog-like creature that is covered in green scales. It has a long tongue that it uses to catch its prey. The Frog Prince is a dangerous creature that should be avoided if possible.,"Dangerous creature , Frog , Large , Green"
Frost Giant,"The Frost Giant is a massive creature made entirely of ice. It is incredibly strong and resistant to damage, making it a fearsome opponent. It is slow and ponderous, but can still crush opponents with its enormous fists. It is immune to fire damage, and can cause frostbite with its icy touch.","Giants , Ice , Damage , Resistance"
Gargoyle,"The Gargoyle is a fearsome creature that lurks in the shadows, waiting to pounce on its unsuspecting prey. It has razor-sharp claws and teeth, and its body is covered in tough, scaly armor. This creature is fast and agile, making it a difficult foe to defeat.","Horror, Monsters , Dark , Gothic"
Gelatinous Cube,"The Gelatinous Cube is a large, amorphous creature that is composed of a clear, jelly-like substance. It is typically found in dark, damp places, and is often seen lurking in the shadows. This creature is feared for its ability to dissolve organic matter, and for its voracious appetite. Those who cross its path often find themselves being consumed by this monstrous being.","Horror, Nature , Science , Creepy"
Ghast,"The Ghast is a fearsome creature that lurks in the dark, preying on unsuspecting victims. It has a large, toothy mouth and long, sharp claws that it uses to rend its prey. The Ghast is a fearsome opponent that should not be underestimated.","Horror , Prey , Darkness , Fearsome"
Ghost,"This monster would be a fearsome opponent, appearing as a spectral figure with glowing eyes. It would be difficult to hit, and would deal high damage with its attacks.","Horror , Spirits , The undead , The supernatural"
Ghoul,"The Ghoul is a monster that lurks in the dark, waiting to ambush its unsuspecting prey. It is a fearsome creature, with sharp claws and teeth that can rend flesh from bone. It is said that the Ghoul is born from the souls of the damned, and that it feeds on the living to sustain itself. Beware the Ghoul, for it is a deadly foe.","Horror , Undead , Monster , Dark"
Giant Ape,"The Giant Ape is a massive, hulking creature that towers over most other enemies in the game. It is incredibly strong, and can easily crush players with its powerful attacks. It is also very fast and agile for its size, making it a very dangerous opponent.","Strength , Speed , Agility , Size"
Giant Badger,"The Giant Badger is a massive creature that towers over most other enemies in the game. It is incredibly aggressive and will charge at the player, trying to swipe them with its massive claws. It is difficult to take down, but if the player can avoid its attacks and get in some good hits, they will eventually be victorious.","Aggressive , Massive , Difficult to take down , Dangerous"
Giant Bat,"The Giant Bat is a large, flying creature that attacks by swooping down on its prey and biting them with its sharp teeth. It is a dark, shadowy creature that is difficult to see in the darkness of the caves where it lives.","Dark and mysterious creature , Flying creature , Biting creature , Cave"
Giant Boar,"The Giant Boar is a massive creature that is covered in thick, bristly fur. It has two large tusks that protrude from its mouth, and its eyes are small and beady. It is a fearsome creature that is capable of charging at its enemies with great force.","Animal , Beast , Fearsome , Nature"
Giant Centipede,"The Giant Centipede is a massive creature that lurks in the dark, dank depths of the world. It is a fearsome predator, preying on anything that crosses its path. The Giant Centipede is a fearsome foe, and will not hesitate to kill anything that stands in its way.","Monsters , Prey , Darkness , Fear"
Giant Constrictor Snake,This monster would be a giant snake that would constrict its prey. It would be a very powerful and dangerous creature that would be difficult to defeat.,"Danger , Strength , Survival , Size"
Giant Crab,"The Giant Crab is a massive creature that lurks in the dark depths of the ocean. It has a hard shell that protects it from most attacks, and its powerful claws can crush anything that gets in its way.","Giant Crab,, Monster, , Threat, , Danger"
Giant Crocodile,"The Giant Crocodile is a massive creature that lurks in the swamps and marshes of the Dark Souls world. This reptilian behemoth is feared by all who know of its existence, for its size and strength are unmatched. Those foolish enough to venture into its territory quickly become its prey, as the Giant Crocodile ruthlessly devours anything that crosses its path.","Monster , Swamps , Marshes , Dark Souls"
Giant Eagle,"The Giant Eagle is a massive bird that can be found soaring through the skies of Lordran. It has a wingspan that is wider than most men are tall, and its talons are as sharp as blades. This creature is feared by many, as it is known to swoop down and snatch up unsuspecting victims in its powerful claws.","Giant Eagle , Lordran , Sky , Wildlife"
Giant Elk,The Giant Elk is a massive creature that towers over most other creatures in the game. It is covered in thick fur that protects it from the cold and its antlers are massive and sharp. It is a peaceful creature but will attack if provoked.,"Nature , Survival , Strength , Courage"
Giant Fire Beetle,This monster would be a giant beetle made of fire. It would be extremely aggressive and would attack anything that came near it. It would be very difficult to kill and would be a major threat to any player that encountered it.,"Fire , Beetle , Aggressive , Threat"
Giant Frog,"This monster would be a giant frog-like creature that would be found in dark, damp areas. It would attack by leaping at its prey and trying to swallow them whole.","Dark and damp areas , Jumps at prey , Swallows prey whole , Frog-like creature"
Giant Goat,"The Giant Goat is a massive creature that towers over most other enemies in the game. It is incredibly strong, and its horns can impale and kill even the most powerful of foes. It is also very fast, and its hooves are deadly weapons. This creature is feared by all who know of it, and it is said that only the most powerful of warriors can hope to defeat it.","Monsters , Strength , Speed , Fearsome"
Giant Hyena,"The Giant Hyena is a massive, feral beast that prowls the darkest depths of Lordran. Covered in shaggy black fur, this monstrous creature has a powerful, muscular build that belies its incredible speed and agility. Its massive jaws are lined with sharp teeth, and its eyes glow a sinister red in the darkness. The Giant Hyena is a fearsome opponent that will stop at nothing to devour its prey.","Feral, Savage , Dangerous , Powerful"
Giant Lizard,"The Giant Lizard is a massive creature that towers over most other enemies in the game. It is covered in thick scales that make it resistant to damage, and its powerful tail can crush or knock down opponents. It is slow and methodical in its attacks, but can be deadly if its opponents are not careful.","Size , Resistance to damage , Slow and methodical , Deadly if opponents are not careful"
Giant Octopus,"The Giant Octopus is a massive creature that lurks in the dark depths of the ocean. It has a large, bulbous body with eight long tentacles that it uses to capture its prey. Its skin is a deep blue color, and its eyes are glowing white orbs that seem to stare into your soul. This creature is feared by sailors and fishermen alike, as it is known to drag them down to the depths of the sea to their doom.","Monsters , The ocean , Danger , Fear"
Giant Owl,"The Giant Owl is a massive creature with wings that span at least 20 feet. It has piercing yellow eyes and a hooked beak that looks capable of tearing flesh from bone. Its feathers are a mottled brown, and it has talons the size of a human hand. This creature is feared by many, as it is known to swoop down on unsuspecting prey and carry them off into the night.","Giant Owl, predator, night, fear, prey"
Giant Poisonous Snake,"This monster would be a giant snake that would be found in dark, dank areas of the game world. It would be covered in poisonous venom that would deal damage to players if they came into contact with it. The snake would be aggressive and would attack players on sight.","Danger , Poison , Dark , Monster"
Giant Rat,"The Giant Rat is a large, rodent-like creature that is found in the dark, dank sewers and caverns of Lordran. It is a aggressive creature that will attack anything that moves, and is known for its large teeth and claws.","Dark and Dangerous , Rat-like creature , Large teeth and claws , Aggressive"
Giant Scorpion,"The Giant Scorpion is a massive arachnid creature that dwells in the dark depths of Lordran. It is a fearsome opponent, armed with a large stinger that can poison its prey, and powerful claws that can rend flesh and bone. The Giant Scorpion is a fearsome foe, and should not be underestimated.","Arachnids , Dark depths , Foes , Poison"
Giant Sea Horse,"This monster would be a giant horse-like creature that lived in the water. It would be a fearsome creature, and would be very difficult to defeat.","aquatic , sea , horse , fearsome"
Giant Shark,The Giant Shark is a massive creature that lurks in the dark depths of the ocean. It is a fearsome predator that can easily devour any creature that it comes across. It is a feared creature by all who know of its existence.,"Giant Shark, ocean, fear, predator"
Giant Spider,"The Giant Spider is a massive arachnid creature that lurks in the dark, dank corners of Lordran. It is a fearsome opponent, whose long, sharp fangs can inject a deadly venom into its prey. The Giant Spider is also incredibly agile, able to climb walls and ceilings with ease, making it a difficult target to hit.","Arachnids , Dark , Venom , Agility"
Giant Toad,"The Giant Toad is a massive creature that lurks in the swamps and marshes of Lordran. It is a fearsome predator, preying on anything that crosses its path. The Giant Toad is covered in slimy, green skin and has a large, gaping mouth filled with sharp teeth. It is a dangerous foe that should not be underestimated.","Giant Toad , Prey , Predator , Lordran"
Giant Vulture,"The Giant Vulture is a massive bird-like creature that can be found in the dark depths of Lordran. This creature is incredibly aggressive and will attack anything that moves, making it a dangerous foe for any would-be adventurer. This creature is also capable of flying, making it difficult to escape from if it decides to pursue its prey.","Dark and Dangerous , Flying , Aggressive , Lordran"
Giant Wasp,"The Giant Wasp is a large insectoid creature that is aggressive and territorial. It has a large stinger that it uses to inject venom into its prey, paralyzing them so that it can devour them alive. The Giant Wasp is a feared creature in the world of Dark Souls, and rightfully so.","Insectoid , Large , Aggressive , Paralyzing venom"
Giant Weasel,"The Giant Weasel is a massive weasel-like creature that roams the dark depths of Lordran. It is a fearsome beast that is known to attack anything that moves, making it a dangerous foe for any adventurer. The Giant Weasel is a massive creature, standing at over 8 feet tall and weighing in at over 500 pounds. It is covered in thick fur that is matted with blood and dirt, and its eyes glow a eerie red in the darkness. The Giant We","Dark, dangerous, fearsome, large"
Giant Wolf Spider,The Giant Wolf Spider is a massive spider that can be found in the dark depths of Lordran. This spider is incredibly aggressive and will quickly attack any player that comes close. The Giant Wolf Spider has a large amount of health and can deal a significant amount of damage with its powerful attacks.,"Dark and Dangerous , Monster , Deadly , Spider"
Gibbering Mouther,"This monster would be a gibbering, monstrous creature with a mouth full of razor-sharp teeth. It would be fast and agile, making it hard to hit, and would be able to spit acid at its enemies.","Horror , Monster , Fear , Danger"
Glabrezu,"The Glabrezu is a massive, four-armed demon with a dog-like head. It is covered in thick, black fur, and has large, sharp claws. It is incredibly strong, and can easily crush opponents with its powerful limbs. It is also very fast and agile, making it a difficult opponent to defeat.","Evil , Demons , Strength , Agility"
Gladiator,"The Gladiator is a fearsome opponent, clad in heavy armor and wielding a large shield and a sword. It is a slow but powerful fighter, capable of dealing massive damage with its attacks.","Warrior , Hero , Myth , Battle"
Gnoll,"The Gnoll is a hulking, bestial creature that lumbers around on all fours, gnashing its teeth and drooling with hunger. It is covered in shaggy fur, and its eyes gleam with a feral intelligence. It is a fearsome opponent, capable of rending flesh from bone with its powerful claws.","Bestial , Feral , Hulking , Intelligent"
Goat man,"The Goatman is a large, humanoid creature with the head and fur of a goat. It is incredibly agile and attacks with its sharp horns and hooves.","Monsters , Mythology , Folklore , Nature"
Goblin,"The Goblin is a small, humanoid creature that is weak and easily killed. It has no real combat ability and exists only to annoy and harass the player. It is fast and agile, making it hard to hit, and its small size makes it hard to damage with most weapons.","Threat , Trickery , Speed , Agility"
