Name,Descriptions,Keywords
Pseudodragon,"This creature would be a small, dragon-like creature that would be difficult to hit due to its size. It would have a poisonous sting in its tail that could debilitate opponents, and it would be able to breathe fire. This creature would be difficult to defeat, but would be especially dangerous in groups.","Dragons , Poison , Fire , Debilitation"
Pteranodon,"This flying reptile would be a fearsome opponent in Dark Souls, swooping down on players from above with its powerful talons. It would likely be found in areas with high ceilings, such as ruins or caves, making it a difficult foe to take down.","Flying , Reptile , Dangerous , High ceilings"
Purple Worm,"This massive, purple worm is over 50 feet long and has a large, gaping mouth filled with sharp teeth. Its body is covered in thick, tough scales, and it has a long, barbed tail. It burrows through the ground at high speeds, and when it emerges, it can snap its powerful jaws shut on anything that gets in its way.","Horror, Nature , Destruction , Size"
Quasit,"The Quasit is a small, demonic creature that lurks in the shadows, waiting to pounce on its unsuspecting prey. It has sharp claws and teeth, and its body is covered in slimy, black fur. Quasits are agile and quick, making them difficult to hit, and they can also teleport short distances.","Evil , Horror , Teleportation , Small creature"
Quipper,"This monster would be a small, fast-moving creature that would dart around the battlefield, attacking the player with its sharp teeth. It would be difficult to hit, and would cause bleeding damage with its bites.","Fast, Small , Sharp Teeth , Bleeding"
Rakshasa,"The Rakshasa is a fearsome and powerful demon that lurks in the shadows, waiting to strike at its unsuspecting prey. It is a cunning and ruthless hunter, using its powerful claws and teeth to rend its victims apart. The Rakshasa is also said to be able to control the minds of its victims, making them do its bidding.","Demon , Hunter , Cunning , Mind Control"
Rat King,"The Rat King is a fearsome creature that lurks in the shadows, waiting to pounce on its unsuspecting prey. It is a large, muscular creature with sharp claws and teeth that can easily tear through flesh. It has beady eyes that seem to almost glow in the dark, and its fur is matted and filthy. This creature is to be avoided at all costs, as it is sure to bring death and destruction to anything that crosses its path.","Monsters , Fear , Violence , Survival"
Ravenous Ghoul,"The Ravenous Ghoul is a monster that lurks in the dark, waiting to ambush its unsuspecting prey. It is a fearsome creature, with sharp claws and teeth that can rend flesh from bone. It is fast and agile, making it difficult to escape from once it has set its sights on you. Beware the Ravenous Ghoul, for it is a deadly foe.","Monsters , Fear , Survival , Darkness"
Red Dragon Wyrmling,"This small, red dragon wyrmling is barely bigger than a human child. It has a long, sinuous body with small wings that allow it to glide short distances. It has sharp claws and teeth, and its tail is tipped with a poisonous stinger. It is intelligent and cunning, and its breath weapon is a jet of fire.","Adventure , Dragons , Fire , Intelligence"
Reef Shark,"This monster would be a large, aggressive shark that would patrol the waters around a dark, sunken reef. It would be fast and powerful, able to easily take down unwary swimmers. Players would need to be careful when exploring the reef, as the shark would be a constant threat.","Danger , Predators , Marine life , Sunken reefs"
Remorhaz,"The Remorhaz is a large, worm-like creature that dwells in cold, dark places. It is covered in a layer of icy crystals, and its body is filled with a burning, acidic substance. The Remorhaz is a fearsome opponent, and its touch can instantly freeze and burn its victims.","Monsters , Cold , Dark , Acid"
Rhinoceros,"The Rhinoceros is a massive, horned creature that lumbers through the dark, dank caverns of Lordran. It is a fearsome beast, capable of crushing and impaling its foes with its powerful body and sharp horns. Players must be careful when fighting this monster, as its size and strength can easily overwhelm them.","Animal , Environment , Combat , Lordran"
Riding Horse,"This monster would be a fearsome creature, likely found in the dark depths of the game world. It would be a large horse, likely black in color, with red eyes that seem to glow with an inner fire. It would be a fearsome opponent, charging at the player with great speed and power.","Monster , Dark , Horse , Fearsome"
Roc,"The Roc is a massive bird-like creature that can be found in the dark depths of the game world. It is a fearsome opponent that can attack with its powerful beak and talons, and is also capable of lifting players off the ground and carrying them away.","Monsters , Strength , Flight , Dark"
Roper,"The Roper is a large, dark creature that hangs from the ceiling, waiting to ambush its prey. It has long, sharp claws that it uses to grab and hold onto its victims, and it drags them up into the darkness to devour them.","Horror, Dark , Monster , Suspense"
Rug of Smothering,"This monster would be a large, shapeless mass that would slowly move towards the player, trying to envelop them in its body. It would be slow and relentless, and would be difficult to damage or kill.","Smothering , Fear , Intimidation , Slow"
Rust Monster,"The Rust Monster is a large, hulking creature that is covered in rust-colored scales. It has two large horns on its head, and its mouth is full of sharp teeth. It is a fearsome creature that is known for its ability to rust metal with its touch.","Monsters , Rust , Scales , Horns"
Saber-Toothed Tiger,"The Saber-Toothed Tiger is a large, ferocious feline creature with long, sharp teeth. It is a fearsome predator that stalks its prey through the shadows, waiting to pounce when they are least expecting it. This monster is feared by all who cross its path, and it is sure to give any player a challenge.","Fearsome predator , Shadows , Prey , Challenge"
Sahuagin,The Sahuagin is a monster that lurks in the dark depths of the ocean. It is a fearsome creature with razor sharp teeth and claws that can rip apart its prey. The Sahuagin is a cunning hunter that will stalk its prey before attacking with lightning speed.,"Monsters , The ocean , Fearsome , Cunning"
Salamander,"The Salamander is a large, lizard-like creature that dwells in dark, damp places. It is a fearsome predator, armed with sharp claws and teeth, and a long, barbed tail. The Salamander is also able to spit fire, and is immune to most forms of attack.","Survival , Fire , Dark Places , Predators"
Satyr,"The Satyr is a fearsome creature that lurks in the dark, waiting to pounce on its unsuspecting prey. It has sharp claws and teeth that can rend flesh from bone, and its powerful hind legs allow it to leap great distances. Beware its wicked horns, for they are said to be able to pierce even the thickest armor.","Fearsome, dark creature, lurking in the dark, pounces on unsuspecting prey, has sharp claws and teeth, powerful hind legs, can leap great distances. , Horns, wicked, can pierce armor, creature from the wild, Satyr. , Wild, creature, lurking in the woods, Satyr. , Dark, forest, creature, Satyr."
Scorpion,"The Scorpion is a large, arachnid-like creature that is found in the dark depths of the game world. It is aggressive and will attack anything that moves, making it a dangerous foe for any player. The Scorpion has a large stinger on its tail that can poison its victims, and its claws are also poisonous. It is a difficult enemy to defeat, but can be killed with enough perseverance.","Dark and Dangerous , Poisonous , Arachnid , Difficult"
Scout,"The Scout is a small, nimble creature that lurks in the shadows, waiting to ambush its unsuspecting prey. It is quick and agile, making it difficult to hit, and its sharp claws can deal significant damage.","Stealth , Agility , Small size , Lurking in the shadows"
Sea Hag,"The Sea Hag is a vile creature that lurks in the dark waters of the world, preying on the unwary. It is a hulking beast, covered in slimy scales and armed with sharp claws and teeth. It is a fearsome opponent, and those who face it often do not live to tell the tale.","Horror , Nature , Seafaring , Monsters"
Sea Horse,"The Sea Horse is a massive creature that lurks in the dark depths of the ocean. It is a fearsome predator, preying on anything that crosses its path. It is heavily armored, with thick scales that protect it from most attacks. Its long, powerful tail is tipped with a barbed sting that can paralyze its prey. It has a large mouth filled with sharp teeth, and its eyes glow a eerie green in the darkness.","The Sea Horse is a fearsome predator that lurks in the dark depths of the ocean. , It is heavily armored, with thick scales that protect it from most attacks. , Its long, powerful tail is tipped with a barbed sting that can paralyze its prey. , It has a large mouth filled with sharp teeth, and its eyes glow a eerie green in the darkness."
Shadow of the Colossus,"This monster would be a giant, hulking creature that would tower over the player. It would be heavily armored, and its attacks would be powerful and devastating.","Giant , Combat , Mounted , Shadow"
Shambling Mound,"The Shambling Mound is a large, amorphous creature that lumbers around slowly, scraping the ground with its long, sharp claws. It is covered in a thick layer of muck and slime, making it difficult to see its true form. When it attacks, it lashes out with its claws or slams its body down onto its prey.","Creepy, Monster, Slippery, Mound , Danger, Foul, Vague, Terrible , Slow, Haunting, Repulsive, Lumbering , Unseen, Unpleasant, Unwelcome, Mysterious"
Shield Guardian,"The Shield Guardian is a massive, hulking creature that lumbers around slowly, but is incredibly tough to take down. It is heavily armored, and its large shield protects it from most attacks. It is a slow, but powerful attacker, and can crush opponents with its massive fists.","Protection , Strength , Slow , Tough"
Shrieker,"The Shrieker is a fearsome creature that lurks in the dark, waiting to pounce on its unsuspecting prey. It has long, sharp claws that can rend flesh and bone, and its teeth are sharp enough to puncture even the thickest armor. Its eyes glow a eerie green, and its body is covered in a thick, black fur.","Horror , Fear , Monsters , Dark"
Silver Dragon Wyrmling,"This monster would be a small, silver dragon that is still young. It would be weak, but still dangerous because of its fire breath. It would be found in areas where there are dragons, or in areas that are cold.","Dragons , Fire , Weakness , Danger"
Skeleton Knight,"The Skeleton Knight is a fearsome undead creature that wanders the dark halls of Lordran. Wielding a mighty greatsword, this knight is a formidable opponent that should not be underestimated.","Undead , Dark , Sword , Fearsome"
Solarus,"A large, hulking creature, Solarus is a fearsome opponent. Resembling a cross between a bear and a lion, this massive beast is covered in thick fur and wields a deadly claws. Solarus is a powerful creature, and will not hesitate to use its strength to crush its foes.","Strength , Fur , Claws , Beast"
Spectator,"The Spectator is a fearsome creature that lurks in the shadows, waiting to pounce on its unsuspecting prey. It has long, sharp claws that can rend flesh from bone, and its teeth are sharp enough to puncture even the toughest armor. It is a cunning and vicious predator, and will stop at nothing to get its next meal.","Predator , Lurker , Shadow , Fear"
Specter,"The Specter is a fearsome and deadly creature that lurks in the shadows, preying on the unsuspecting. It is a fearsome opponent that can strike with lightning speed, and its claws are sharp enough to rend flesh and bone.","Horror , Fear , Death , Darkness"
Spider Knight,"The Spider Knight is a fearsome opponent, wielding a large sword and shield. It is clad in heavy armor, and its helmet is adorned with spikes. It is a agile fighter, and is capable of leaping great distances. It is also able to shoot webbing from its hands, which can entangle and immobilize its foes.","agility , webbing , spikes , heavy armor"
Spirit Naga,"The Spirit Naga is a fearsome creature that lurks in the dark, preying on unsuspecting victims. It is a large snake-like creature with a human-like head, and it is said to be able to spit venom that can kill a person in seconds. It is a feared creature that many avoid, and those that have faced it in combat often speak of its speed and ferocity.","Fear , Prey , Venom , Speed"
Sprite,"This monster would be a small, fast creature that would dart around the battlefield, attacking with quick, sharp strikes. It would be difficult to hit, and would be especially dangerous in groups.","agile , fast , small , quick"
Spyder,"The Spyder is a large, arachnid-like creature that lurks in the dark, dank corners of Lordran. It is a fearsome opponent, capable of spinning webs to ensnare its prey and delivering powerful, poisonous bites.","Dark and Dangerous , Arachnids , Stealth and ambush , Web spinning"
Steam Mephit,"This monster would be a small, humanoid creature made entirely of steam. It would be very agile and difficult to hit, and would attack by shooting steam at its enemies. It would be weak to fire and would be found in areas with a lot of water.","Steam , Agility , Weakness to fire , Found in areas with a lot of water"
Stirge,"The Stirge is a small, bat-like creature that hangs upside down from ceilings, waiting to swoop down on its unsuspecting prey. It has sharp claws and a long, barbed tongue that it uses to drain the blood of its victims.","predators , scavengers , bloodsucking , upside down"
Stone Giant,"The Stone Giant is a massive creature made entirely of stone. It is incredibly strong and durable, making it a very dangerous foe. It is slow and lumbering, but can deal massive damage with its fists and feet. It is immune to most forms of attack, but can be harmed by fire and lightning.","Stone, giant, creature, made, entirely, stone, incredibly, strong, durable, slow, lumbering, can, deal, massive, damage, with, fists, feet, immune, most, forms, attack, can, be, harmed, by, fire, lightning"
Stone Golem,"The Stone Golem is a massive creature made entirely of stone. It is incredibly slow and ponderous, but its massive size and strength make it a formidable opponent. It attacks by slamming its fists into the ground, causing large shockwaves that can damage and knock down opponents. It can also pick up and throw large boulders.","Stone, Golem, creature, massive, slow, ponderous, strength, opponent, attack, by, slamming, fists, ground, causing, large, shockwaves, damage, knock, down, opponents, can, pick, up, and, throw, large, boulders"
Storm Giant,"The Storm Giant is a massive creature, towering over most other enemies in the game. It is covered in thick armor, making it difficult to damage, and wields a huge hammer that it can use to crush its opponents. It is a slow but powerful enemy, and will often try to keep its distance from the player, using its hammer to knock them back if they get too close.","Powerful , Huge , Armor , Slow"
Succubus/Incubus,"This monster would be a humanoid creature with large, leathery wings. It would have long, sharp claws and teeth, and would likely be covered in scales or fur. Its eyes would be red, and it would have a long, prehensile tongue. It would be fast and agile, and would be able to fly.","Sexuality/Deviance , Violence/Terror , Loss/Despair , Transformation"
Swarm of Bats,"This monster would be a small, flying creature that would attack in swarms. They would be difficult to hit and would do small amounts of damage, but could quickly overwhelm an opponent if not dealt with.","Flying creatures , Swarms , Damage , Difficult to hit"
Swarm of Insects,"This monster would be a small, fast-moving enemy that would be difficult to hit. It would be weak individually, but could overwhelm players with numbers.","Swarm , Insects , Fast , Difficult to Hit"
Swarm of Poisonous Snakes,"This monster would be a fearsome opponent, a writhing mass of poisonous snakes that would strike at the player with deadly precision. Their venom would be deadly, and their numbers would be overwhelming, making them a force to be reckoned with.","Deadly , Vicious , Deadly Poison , Venomous"
Swarm of Quippers,"This monster would be a small, fast-moving creature that attacks in swarms. They would be difficult to hit and would do a lot of damage with their bites.","Swarm , Fast , Small , Bite"
Swarm of Rats,"This monster would be a small, fast enemy that would swarm the player and try to bite them. They would be weak individually, but dangerous in large numbers.","Swarm , Rat , Small , Fast"
Swarm of Ravens,"This monster would be a flying enemy that would attack the player in swarms. They would be weak individually, but their numbers would make them a threat. They would likely be found in areas where there is little light, and would be difficult to hit due to their small size and erratic movement.","Enemies/Enemies, Flying, Swarm, Weakness"
Tarrasque,"The Tarrasque is a massive, hulking creature, covered in thick armor plating. It has two large horns protruding from its head, and a long tail. It is incredibly strong and ferocious, and is capable of tearing through even the strongest of defenses.","Monsters , Strength , Ferocity , Armor"
Thug,"The Thug is a large, brutish creature that lumbers around slowly, but is incredibly strong. It has large, sharp claws that it uses to rend its enemies, and a large mouth full of sharp teeth. It is covered in thick, dark fur, and its eyes glow a sinister red.","Violence and aggression , Strength and power , Survival and adaptation , Redundancy and redundancy"
Tiger,"The Tiger is a large, powerful feline creature that prowls the dark forests of Lordran. It is a fearsome predator, capable of tearing apart its prey with its sharp claws and teeth. The Tiger is also incredibly fast and agile, making it a difficult foe to defeat in combat.","Strength and Power , The Tiger's Hunt , The Tiger's Domain , The Tiger's Strength"
Treant,"The Treant is a massive, lumbering creature, covered in bark and leaves. It moves slowly, but its huge arms can deal massive damage to anything that gets in its way. It is immune to fire, and can regenerate its health quickly.","Nature, Strength , Regeneration , Immune to Fire"
Tribal Warrior,"The Tribal Warrior is a fearsome opponent, clad in little more than a loincloth and armed with a crude spear. He is incredibly agile, and his spear thrusts are incredibly fast and deadly. He is also proficient with a shield, and can use it to bash opponents and deflect attacks.","Warrior , Tribal , Agility , Spear"
Triceratops,"The Triceratops is a large, four-legged creature with a long neck and tail. It has a large, triangular head with two long horns protruding from its forehead, and a smaller horn on its nose. Its body is covered in thick, scaly skin, and its legs end in sharp claws. It is a slow and lumbering creature, but its size and strength make it a formidable opponent.","Animal , Dinosaurs , Land , Strength"
Troll,"The Troll is a massive, hulking creature that lumbers around slowly, but is incredibly strong. It has long, sharp claws that it uses to rend and tear its enemies apart, and a mouth full of sharp teeth that it uses to bite and tear flesh. It is covered in a thick, matted fur that protects it from most attacks, and its small, beady eyes are almost impossible to see.","Monsters , Strength , Slow and Steady , Fur"
Twig Blight,"The Twig Blight is a small, humanoid creature that is covered in twigs and leaves. It has a long, sharp beak that it uses to peck at its enemies. The Twig Blight is a fast and agile creature that is difficult to hit.","Nature, Survival , Agility , Fast"
Tyrannosaurus Rex,"This massive creature would be one of the most feared enemies in Dark Souls. It would be a hulking beast, easily twice the size of a human, with razor sharp teeth and claws. It would be fast and agile, making it a difficult target to hit, and would be able to deal massive damage with just a few swipes of its claws.","Monsters , Strength , Size , Fear"
Unicorn,"This monster is a large, horse-like creature with a single, spiraling horn protruding from its forehead. It is said to be incredibly swift and agile, making it a difficult target to hit, and its horn is said to be poisonous. It is a fearsome opponent in battle, and is best avoided if possible.","Mythology/Folklore , Nature , Courage , Magic"
Vampire,"The Vampire is a fearsome creature that lurks in the shadows, preying on the unsuspecting. It is a fast and agile creature, capable of dealing quick and deadly strikes. The Vampire is also able to transform into a bat-like creature, making it difficult to track and even more dangerous.","Fear , Bloodlust , Darkness , The undead"
Vampire Spawn,"This monster would be a humanoid creature with pale skin and long, sharp fangs. It would be fast and agile, and would drain the blood of its victims to heal itself.","Horror , Bloodlust , Vampires , Undead"
Veteran Knight,"This monster would be a fearsome opponent, clad in full armor and wielding a deadly weapon. It would be a skilled warrior, capable of felling even the most powerful of foes.","Warrior , Combat , Veteran , Knight"
Violet Fungus,"This monster would be a large, purple fungus that would attack by spewing poisonous spores at its enemies. It would be a slow moving, but deadly foe that would be difficult to take down.","Poisonous , Fungal , Slow moving , Deadly"
Vrock,"This monster would be a large, demonic creature with wings. It would be fast and agile, and would attack with its claws and teeth. It would be resistant to fire, and would be found in areas of high heat.","Evil , Demons , Heat , Agility"
Vulture,"The Vulture is a large, flying creature that attacks with its powerful beak and talons. It is a fearsome opponent that can quickly take down its prey.","scavenger , predator , scavenging , scavenging behavior"
Warhorse,"This horse-like creature is covered in thick, dark fur. It has large, sharp horns protruding from its head, and its eyes glow red with fury. It is a fearsome opponent in battle, and is known for its strength and stamina.","Warhorse , Animal , Strength , Stamina"
Warhorse Skeleton,"This monster would be a skeletal horse that is reanimated by dark magic. It would be a fearsome opponent that would be difficult to take down. It would likely be found in dark, dank places where dark magic is prevalent.","Dark magic , Skeletal horse , Reanimated , Fearsome"
Water Elemental,"This monster is a water elemental. It is a humanoid creature made entirely of water. It has no eyes, but it has a mouth with sharp teeth. It is very agile and fast, and it can shoot water from its mouth.","aquatic , elemental , magical , water"
Weasel,"The Weasel is a small, rodent-like creature that is found in the dark corners of Lordran. It is a timid creature that will flee at the first sign of danger, but can be aggressive if cornered. It is not a particularly powerful creature, but can inflict a nasty bite if provoked.","Dark and mysterious , Small and timid , Animalistic , Fearful"
Werebear,"The Werebear is a large, furry creature that attacks with its powerful claws. It is fast and agile, making it a difficult target to hit. When low on health, the Werebear will enter a rage, increasing its damage output and making it even more dangerous.","Animalistic , Feral , Strength , Rage"
Wereboar,"The Wereboar is a large, feral creature that is half-man, half-boar. It is incredibly strong and aggressive, and will attack anything that it perceives as a threat. It is covered in thick fur and has large, sharp tusks that it uses to rend and tear its prey.","Feral , Animal , Strength , Aggression"
Wererat,"The Wererat is a monster that lurks in the shadows, waiting to ambush its unsuspecting prey. It is a humanoid creature with the head of a rat, and its body is covered in shaggy fur. It has long, sharp claws that it uses to rend its victims, and its teeth are sharp enough to bite through armor.","Stealthy , Rat-like , Fast , Savage"
Weretiger,"The Weretiger is a fearsome creature that lurks in the shadows, ready to pounce on its unsuspecting prey. It is a large cat-like creature with tiger-like stripes running down its back, and its eyes glow a eerie green in the darkness. It is a fearsome opponent that will not hesitate to rip its foes to shreds with its powerful claws and teeth.","Fearsome , Savage , Stealthy , Powerful"
Werewolf,"The Werewolf is a large, wolf-like creature that is covered in shaggy fur. It has large, sharp claws and teeth, and its eyes glow red. It is incredibly fast and agile, and is able to leap great distances. It is incredibly strong, and is able to rip its enemies apart with its bare hands.","Mythology/Folklore , Animalism , Wilderness , Survival"
White Dragon Wyrmling,"This small, white dragon wyrmling is barely bigger than a human child. It has a long, slender body with delicate wings, and a long tail. Its eyes are a deep blue, and its teeth and claws are sharp. It is a young dragon, but it is already quite dangerous.","innocence, purity, vulnerability , power, strength, aggression , growth, change, transformation , magic, sorcery, power"
Wight,The Wight is a skeletal undead creature that wields a scimitar in each hand. It is a fast and agile creature that can leap great distances. It is weak to fire and light attacks.,"undead, skeletal, scimitar, fast, agile, light, weak"
