Prompt:,"IName:,","Completion:,",Fia's Robe,IDescription:,"Robe of black cloth that covers the entire body.Worn by Fia, the Deathbed Companion, on her journey after being exiled from her home.The fabric itself is soft as silk and thin enough that those embraced can feel every pulse; every bit of her warmth.",IType:
Prompt:,"IName:,","Completion:,",Finger Maiden Shoes,IDescription:,"Shoes worn by maidens who serve the Two Fingers.The maidens live to serve a chosen Tarnished, sharing their guidance and the wisdom of the Two Fingers.The guidance of grace would ensure that the pair be brought together. Or at least, such was the promise long ago.",IType:
Prompt:,"IName:,","Completion:,",Fingerprint Armor,IDescription:,"Iron armor singed and blistered by fingers.Worn by Vyke, knight of the Roundtable Hold.No other Tarnished was closer to the throne of the Elden Lord than Vyke. But without announcement, Vyke traveled far below the capital, and was scorched by the flame of frenzy.Did he make his choice for his maiden, or did some other force lure him with suggestion?",IType:
Prompt:,"IName:,","Completion:,",Fire Keeper Robe,IDescription:,"Robe, Manchettes and Skirt worn by the guardian of the shrine. The Fire Keepers were robbed of light, to better serve as vessels for souls. Only those who cherish the writhing, searing darkness were given the keeper's black attire.",IType:
Prompt:,"IName:,","Completion:,",Fire Monk Armor,IDescription:,"Black iron armor adorned with a red cloth.
Attire of the Fire Monks.
The grotesque face sculpted on the chest is said to depict the corrupt ancient god of the flame.
Taboos transform into lasting obsessions by virtue of the fear that they inspire.",IType:
Prompt:,"IName:,","Completion:,",Fire Prelate Helm,IDescription:,"Helm engraved with a sacred countenance and housing a cauldron.Attire of the Fire Prelates, commanders of the Fire Monks.It is said the cauldron perched atop the head was originally furnished with embers, and would surge into flames when the wearer's faith reached its zenith. The fire of this cauldron has since died out, however.",IType:
Prompt:,"IName:,","Completion:,",Fire Witch Gauntlets,IDescription:,"Gloves of witches who bore the Profaned Flame, now harrowed spirits of Irithyll. The witches who lead the Pontiff's Knights were originally ordained as holy knights. It was not long however, before their hearts were swallowed by the Profaned Flame",IType:
Prompt:,"IName:,","Completion:,",Firelink Armor,IDescription:,"Armor of the Soul of Cinder, a deific manifestation of the Lords of Cinder, who linked the First Flame. It resembles a knight's armor, but bears hideous burns and contortions..A mishappen crown can be seen upon its Helm. The Armor taking the shape of a deathly ribcage. It exists as a symbol of the great Lords and the noble act of linking the fire, though it is no more than an empty husk.",IType:
Prompt:,"IName:,","Completion:,",Foot Soldier Greaves,IDescription:,"Metal Graves that have already been mended countless times.Widely issued to foot soldiers in a lord's army.",IType:
Prompt:,"IName:,","Completion:,",Foot Soldier Tabard,IDescription:,Padded cloth armor with more than a few stains. Widely issued to foot soldiers in a lord's army.,IType:
Prompt:,"IName:,","Completion:,",Foreign Garb,IDescription:,"Clothing worn upon awakening to the nightmare of blood and beasts. Not typical clothing for Yharnam, perhaps it is of foreign origin. It is said, after all, the traveler came to Yharnam from afar. Without memory, who will ever know?",IType:
Prompt:,"IName:,","Completion:,",Fur Raiment,IDescription:,"Raiment fashioned from a bristly pelt.Worn by ancestral follower warriors.The ancestral followers keep their distance from the Erdtree,awaiting new buds. They are certain to sprout from their veryflesh, and indeed, their souls.",IType:
Prompt:,"IName:,","Completion:,",Gascoigne's Cap,IDescription:,"Hunter attire worn by Father Gascoigne. Similar to hunter garb created at the workshop, only these are tainted by a pungent beastly stench that eats away at Gascoigne.Father is a title used for clerics in a foreign land, and there is no such rank in the Healing Church.",IType:
Prompt:,"IName:,","Completion:,",Gascoigne's Garb,IDescription:,"Hunter attire worn by Father Gascoigne. The dingy scarf is a Holy Shawl and symbol of the Healing Church, from which Gascoigne would eventually part ways. Father is a title used for clerics in a foreign land, and there is no such rank in the Healing Church.",IType:
Prompt:,"IName:,","Completion:,",Gauntlets of Favor,IDescription:,"Guantlets of the pitiable Embraced Knight. Depicts the affection of goddess Fina. Adrift on sea of isolation, only his faith in the love of his goddess remained true, and so the knight forsook all else. The face of the guantlets are crafted to depict the goddess's embrace, quite ignoring the fact that her love is in fact as fickle as the weather",IType:
Prompt:,"IName:,","Completion:,",Gauntlets of the Vanquisher,IDescription:,"Strange gauntlets from the ancient land of Zena, birthplace of the curious dealer Domhnall. They gold bracelets symbolize a vanquisher",IType:
Prompt:,"IName:,","Completion:,",Gauntlets of Thorns,IDescription:,"Guantlets of Kirk, the notorious knight of Thorns. A dense patch of thorns grows from its surface. A fitting item for the murderous Kirk, for even the simple act of rolling can damage enemies when wearing this attire.",IType:
Prompt:,"IName:,","Completion:,",Gehrman's Hunter Cap,IDescription:,"Hunter attire of Gehrman, the first hunter. Created before the workshop existed by making adjustments to everyday clothing, and later became the basis for all hunter's garb.The hunter's emphasis on engaging beasts with speed, and therefore of selecting lightweight attire, no doubt traces back to Gehrman's own combat style.",IType:
Prompt:,"IName:,","Completion:,",Gehrman's Hunter Garb,IDescription:,"Hunter attire of Gehrman, the first hunter. Created before the workshop existed by making adjustments to everyday clothing, and later became the basis for all hunter's garb. The hunter's emphasis on engaging beasts with speed, and therefore of selecting lightweight attire, no doubt traces back to Gehrman's own combat style.",IType:
Prompt:,"IName:,","Completion:,",Gelmir Knight Armor,IDescription:,"Armor worn by knights once royal to Praector Rykard.It bears an emblem that none wear any longer, standing as it does for a lord that fell from loft ambition into gluttonous depravity. As the lord lost his dignity, so too did these knights lose their master.",IType:
Prompt:,"IName:,","Completion:,",Giant Armor,IDescription:,"Armor of the giant sentinels of Anor Londo. Made from ancient brass, it also offers protection versus non-physical attacks, but due to its giant size, it is extremely heavy for humans, and impedes stamina recovery.",IType:
Prompt:,"IName:,","Completion:,",Gilded Foot Soldier Cap,IDescription:,"Flanged cap made from gilded iron.Issued to foot soldiers protecting the royal capital of Leyndell.",IType:
Prompt:,"IName:,","Completion:,",Gloom Armor,IDescription:,"Black iron armour worn by Yurt, the Silent Chief. A portion of the complete armor set which has an extremely high level of adhesion.The black iron robs the wearer of his or her body heat, causing them to shiver and breathe out cold air.",IType:
Prompt:,"IName:,","Completion:,",Godrick Knight Armor,IDescription:,"Armor worn by knights loyal to Godrick The Grafted.Its left breast is emblazoned with a two-headed war axe, an emblem of the golden lineage. The knights surely boasted of their strength in days long gone.",IType:
Prompt:,"IName:,","Completion:,",Godskin Apostle Robe,IDescription:,"Robe made by sewing together patches of smooth skin.Worn by the Godskin Apostles.The apostles, once said to serve Destined Death, are wielders of the god-slaying black flame. But after their defeat by Maliketh, the Black Blade, the source of their power was sealed away.",IType:
Prompt:,"IName:,","Completion:,",Godskin Noble Hood,IDescription:,"Hood made by sewing together patches of smooth skin.Subcutaneous fat makes it plump and soft.Worn by Godskin Nobles.Nobles are the most ancient apostles who are said to have assimilated inhuman physiology. Not unlike the crucible, the Erdtree in its primordial form.",IType:
Prompt:,"IName:,","Completion:,",Gold Ardeo,IDescription:,"The odd helmet worn by the band of Executioners commanded by the martyr Logarius. The conical gold helmet, symbol of the executioners, represents luminosity, ambition, and an unflagging resolve to face impurity, staring it down with stern golden spirit. As the great Logarius once said, Acts of goodness are not always wise, and acts of evil are not always foolish, but regardless, we shall always strive to be good.",IType:
Prompt:,"IName:,","Completion:,",Gold-Hemmed Black Cloak,IDescription:,"Worn by the witch Quelana of Izalith, mother of pyromancy and Daughter of Chaos. She wore this gold-hemmed black cloak before even the Age of Fire, and it offers strong resistance versus fire, poison, and other perils.",IType:
Prompt:,"IName:,","Completion:,",Goldmask's Rags,IDescription:,"Worn rags that just barely cover the body.Lord Goldmask felt no draw to the vain excess of clothing; what use is finery to one who seeks greater brilliance?",IType:
Prompt:,"IName:,","Completion:,",Golem Armor,IDescription:,"Body of the Iron Golem, guardian of the ancient Sen's Fortress, slayer of heroes who ventured forth to Anor Londo. Without its core, it is a mere hunk of iron, and can be equipped as solid protective gear, but its immense weight hinders stamina recovery",IType:
Prompt:,"IName:,","Completion:,",Gough's Armor,IDescription:,"Armor of Hawkeye Gough, one of Gwyn's Four Knights. Armor donned by Gough since his days as a dragonslayer. The medallion, bequeathed by the Lord Himself, and the dragon bone pauldrons are symbols of the highest honors",IType:
Prompt:,"IName:,","Completion:,",Grave Warden Robe,IDescription:,"Rotting, tattered skirt, robe, hood and wrap. Attire of grave wardens at the Cathedral of the Deep. Grave wardens were tasked with disposing of the ever rising corpses that plagued the cathedral. Their clothes are utterly putrid, drenched in the blood and mucilage of their undertaking.",IType:
Prompt:,"IName:,","Completion:,",Grave Warden Top,IDescription:,"Worn by a Grave Warden sorcerer. The man claims to have sealed himself away, but who's ever heard of sentient magic? It is no doubt difficult to judge the veracity of the man's words, but this hood certainly seems to possess an unusual power. He calls himself Navlaan, now.",IType:
Prompt:,"IName:,","Completion:,",Graveguard Mask,IDescription:,"Mask of Dores, graveguard of the Forbidden Woods. His pale countenance mimics the labyrinth watchers. Willem kept two loyal servants back at Byrgenwerth. When they were sent into the labyrinth. they encountered the eldritch Truth. and went mad. One became the password gatekeeper, while Dores became a graveguard of the forest. Both remained loyal, even in madness.",IType:
Prompt:,"IName:,","Completion:,",Graveguard Robe,IDescription:,"Robe of Dores, graveguard of the Forbidden Woods. His pale countenance mimics the labyrinth watchers. Willem kept two loyal servants back at Byrgenwerth. When they were sent into the labyrinth. they encountered the eldritch Truth. and went mad. One became the password gatekeeper, while Dores became a graveguard of the forest. Both remained loyal, even in madness.",IType:
Prompt:,"IName:,","Completion:,",Gravekeeper Cloak,IDescription:,"Defensive wear encircled by bronze snakes.Worn by gladiators who were driven from the colosseum. The wearer becomes a slightly easier target for foes.The snake is viewed as a traitor to the Erdtree, and the audience delighted in seeing these bronze effigies beaten and battered.",IType:
Prompt:,"IName:,","Completion:,",Great Horned Headband,IDescription:,"Headband decorated by a pair of great horns.Worn by ancestral follower warriors.",IType:
Prompt:,"IName:,","Completion:,",Grey Wolf Cap,IDescription:,"Attire of the retired hunter Djura. This worn wolf cap was his trademark. Djura is known through his contact with the Powder Kegs, the heretics of the workshop. He is said to have been both uncommonly kind and dreadfully foolish. Djura felt defeated by the state of Old Yharnam and renounced his hunter's vows.",IType:
Prompt:,"IName:,","Completion:,",Guardian Armor,IDescription:,"Armor of the stone knights, guardians of the forest sanctuary. The stone knights are golems animated by magic, and their enchanted armor is oppressively heavy",IType:
Prompt:,"IName:,","Completion:,",Guardian Bracers,IDescription:,"Engraved golden bracers.Worn by the guardians of the Minor Erdtree.In accordance with an ancient pact with the Erdtree, it is said that their deaths led not to destruction, but instead to renewed, eternal life as guardians.",IType:
Prompt:,"IName:,","Completion:,",Guilty Hood,IDescription:,"Coarse hooded cloak of olive brown.The garb of those accused of lesser crimes, indicated by the collar of sharpened branches.",IType:
Prompt:,"IName:,","Completion:,",Gundyr's Armor,IDescription:,"Ancient armor of a set of cast iron armor, belonging to Champion Gundyr. Modeled after a former king. Gundyr, or the Belated Champion, was bested by an unknown warrior. He then became sheath to a coiled sword in the hopes that someday, the first flame would be linked once more.",IType:
Prompt:,"IName:,","Completion:,",Gyrm Armor,IDescription:,"Armor of the nomadic Gyrm. Excellent poise but heavy. The stocky Gyrm are kind-natured, but humans deemed them impure, and drove them underground",IType:
Prompt:,"IName:,","Completion:,",Haima Glintstone Crown,IDescription:,"One of the glintstone crowns bestowed upon Raya Lucaria scholars whose pursuits were deemed worthy.Increases intelligence and strength to the detriment of FP.Scholars of the Haima Conspectus sought the power to quell conflict, and to this end studied the sorceries of cannon fire and the gavel.",IType:
Prompt:,"IName:,","Completion:,",Haligtree Gauntlets,IDescription:,"Gauntlets worn by soldiers sworn to the Haligtree.Rust-worn and stained through unending conflict.",IType:
Prompt:,"IName:,","Completion:,",Haligtree Knight Armor,IDescription:,"Armor worn by knights sworn the Haligtree.Its left breast is emblazoned with the crest of the Haligtree. Though watered with Miquella's own blood since it was a sapling, the Haligtree ultimately failed to grow into an Erdtree.",IType:
Prompt:,"IName:,","Completion:,",Haligtree Knight Helm,IDescription:,"Helm worn by knights sworn to the Haligtree.Graced by a crown of unalloyed gold.Increases faith.",IType:
Prompt:,"IName:,","Completion:,",Hard Leather Armor,IDescription:,"Armor made of thick leather. Very common type of protective gear, they provide a sound level of defense.",IType:
Prompt:,"IName:,","Completion:,",Hard Leather Armor,IDescription:,A commonplace piece of armor. No embellishments. Very solid,IType:
Prompt:,"IName:,","Completion:,",Harrowed Garb,IDescription:,"Certain Church hunters obfuscate their identities and slip into the nooks and crannies of the city. This is the garb that allows these harrowed individuals to go unnoticed. These hunters are keen to early signs of the scourge, serving as a first line of defense against its outbreak. Or perhaps, when the time is ripe, they find signs of the scourge where there are none. It just goes to show, the corner beggar is not always who he seems.",IType:
Prompt:,"IName:,","Completion:,",Havel's Armor,IDescription:,"Armor worn by Havel the Rock's warriors. Carved from solid rock, its tremendous weight is matched only by the defense it provides. Havel's warriors never flinched nor retreated from battle. Those unfortunate enough to face them were inevitably beaten to a pulp",IType:
Prompt:,"IName:,","Completion:,",Havel's Armor,IDescription:,"A helm and armor as if hewn from a giant boulder. Offers stupendous defense, but weighs a ton. The origin of the name Havel is not clear. Some say it was the warrior who wore the armor, but others say it was the name of a great kingdom ruined in a barbaric war.",IType:
Prompt:,"IName:,","Completion:,",Havel's Gauntlets,IDescription:,"Gauntlets as if hewn from a giant boulder. Highly protective, but excessively heavy. The warriors who followed Havel the Rock never flinched, nor retreated from battle, crushing any foe that stood in their way.",IType:
Prompt:,"IName:,","Completion:,",Heavy Boots,IDescription:,"Boots made of thick leather. The boots of the pyromancers are incredibly tough, on account of the rugged grasslands and treacherous swamps they must traverse. Their soles are nearly impenetrable",IType:
Prompt:,"IName:,","Completion:,",Heide Knight Chainmail,IDescription:,"Chainmail worn by Heide Knights. Whether Heide refers to a kingdom or was just a name for the land is not clear, for no records date back far enough to tell.All that is known is that the Way of Blue has its origins in Heide, and that Heide was later subsumed by the sea.",IType:
Prompt:,"IName:,","Completion:,",Henryk's Hunter Cap,IDescription:,"Hunter's hat worn by Henryk, the old hunter. The taciturn old hunter Henryk was once partners with Father Gascoigne, and though they were a fierce and gallant duo, their partnership led to Henryk's tragically long life. Henryk's unique yellow garb is resistant to bolt and will be of great help to any hunter who has inherited the onus of the hunt.",IType:
Prompt:,"IName:,","Completion:,",Henryk's Hunter Garb,IDescription:,"Hunter's attire worn by Henryk, the old hunter. The taciturn old hunter Henryk was once partners with Father Gascoigne, and though they were a fierce and gallant duo, their partnership led to Henryk's tragically long life. Henryk's unique yellow garb is resistant to bolt and will be of great help to any hunter who has inherited the onus of the hunt.",IType:
Prompt:,"IName:,","Completion:,",Herald Armor,IDescription:,"Steel armor, Leather Gloves and Quilted Trousers said to be worn by Heralds of the Way of White, who deliver commandments of duty. Protection made of steel has excellent physical absorption, but is found lacking against blunt strikes and lightning damage.",IType:
Prompt:,"IName:,","Completion:,",Hexer's Robes,IDescription:,"Grants slight increase to spell uses. Hexing appears to be an offshoot of sorcery, but its specific origins are unknown. Robes worn by a hexer. Belonged to Felkin the Outcast. Those who have a taste of dark are drawn into its vortex and rarely return. Perhaps it appeals to something deep within the human soul.",IType:
Prompt:,"IName:,","Completion:,",Hierodas Glintstone Crown,IDescription:,"One of the glintstone crowns bestowed upon Raya Lucaria scholars whose pursuits were deemed worthy.Increases intelligence and endurance to the detriment of FP.The crown of Hierodas was granted to scholars who engaged in nomadic study away from the academy.",IType:
Prompt:,"IName:,","Completion:,",High Page Hood,IDescription:,"Hood of a page selected for special privilege by the noble they serve.The unassuming sack-like appearance benefits their unseen and unknown stature.",IType:
Prompt:,"IName:,","Completion:,",Highwayman Cloth Armor,IDescription:,"Hideously stained and ragged cloth armor.Worn by former foot soldiers who have turned to banditry.",IType:
Prompt:,"IName:,","Completion:,",Hollow Infantry Armor,IDescription:,"Armor worn by Hollowed infantry. A piece of basic, minimal equipment. Worse yet, they're worn and nearly falling apart. Not recommended unless your options are spent.",IType:
Prompt:,"IName:,","Completion:,",Hollow Soldier Armor,IDescription:,"Apparel worn by Hollow soldiers. It may be old and battered, but its iron construction makes it quite sturdy. It is wise to wear a sturdy form of head protection against arrows and other physical threats. It is so tattered that it barely serves its purpose anymore",IType:
Prompt:,"IName:,","Completion:,",Hollow Soldier Armor,IDescription:,"armor, worn by Hollowed Royal Soldiers. Appears to be crafted with quality materials, but is highly degraded and close to falling apart. Wearing this will be of little use.",IType:
Prompt:,"IName:,","Completion:,",Hollow Thief's Leather Armor,IDescription:,Leather armor worn by Hollow thieves. It stifles noise and helps its wear hide in the shadows,IType:
Prompt:,"IName:,","Completion:,",Hollow Warrior Armor,IDescription:,"Armor worn by Hollow warriors. It is made of thick leather that is tattered with age, It is wise to wear a sturdy form of protection against arrows and other physical threats.",IType:
Prompt:,"IName:,","Completion:,",Holy Robe,IDescription:,"Robe donned by men of the cloth. Though plain to the eye, its hardy fabric repels rain and keeps the body warm. Those dissatisfied with church teachings must test their faith by going on a spiritual journey. Such is the ritual self-purification of the Way of White. Topped by a Distinctive hat worn only by Way of White priests in Thorolund. It is simply meant to show their position within the hierarchy. It holds almost no meaning in the land of Lordran.",IType:
Prompt:,"IName:,","Completion:,",Hoslow's Armor,IDescription:,"Garish silver armor decorated with red embellishments. Passed down through the Hoslow family.When Juno Hoslow received an invitation to the Volcano Manor, he discreetly refused.I have already walked many a road drenched in blood, yet never would I consider myself a champion.",IType:
Prompt:,"IName:,","Completion:,",Hoslow's Helm,IDescription:,"A twin-tailed silver helm decorated with flowery adornments. Symbol of the head of the revered House of Hoslow.Juno Hoslow had a younger brother who was all talk and no trousers. His inability to commit to action was such that Juno inherited the Hoslow legacy without resistance, granting him the freedom to shower his little brother with adoration.",IType:
Prompt:,"IName:,","Completion:,",Hunter Garb,IDescription:,"One of the standard articles of hunter attire fashioned at the workshop, this one without the cape that wipes away blood. A fine piece of hunter attire that provides stable defence to anyone facing Yharnam's beastly threat. Allows one to stalk beasts unannounced, by cover of night.",IType:
Prompt:,"IName:,","Completion:,",Hunter Hat,IDescription:,"One of the standard articles of hunter attire fashioned at the workshop. A fine piece of hunter attire that provides stable defence to anyone facing Yharnam's beastly threat.Recognizable by its withered feathers, this cap is fashioned after one of the old hunters.",IType:
Prompt:,"IName:,","Completion:,",Imperious Armor,IDescription:,"Helmet/Armor/Gauntlets,Leggings worn by once-proud knights.Relics of a party who long ago attempted to conquer the Undead Crypt.For this act of conceit they will never rest in peace, and instead serve as crypt guardians.",IType:
Prompt:,"IName:,","Completion:,",Insolent Armor,IDescription:,"Armor worn by once-proud clerics. Relics of a party who long ago attempted to conquer the Undead Crypt. For this sin their deaths have been postponed, so they may serve as crypt sentries",IType:
Prompt:,"IName:,","Completion:,",Iron Kasa,IDescription:,"Iron kasa of the man who calls himself Shabriri.Crafted to imitate the woven straw hats worn in the Land of Reeds.The man, once known as Yura, kept a woman in the deepest reaches of his heart.",IType:
Prompt:,"IName:,","Completion:,",Ironclad Armor,IDescription:,"Armor worn by Ironclad Soldiers. Provides high defense, but is so heavy that it requires great strength to move. The Ironclad Soldiers were minions created by the Old Iron King, their life granted by an enchantment of souls. By now this is again an iron husk, and fit to wear. Once, the Old King could have unraveled the greater mysteries with the aid of his great soul, but he was led astray by his enormous fortune, becoming nothing more than a vulgar hedonist",IType:
Prompt:,"IName:,","Completion:,",Jailer Robe,IDescription:,"Robe worn by jailers of Irithyll Dungeon. Originally ritualistic formal wear. The jailers were among the few survivors inhabiting the Profaned Capital, later serving under Pontiff Sulyvahn. Perhaps the screams emanating from the cells help them forget their old home.",IType:
Prompt:,"IName:,","Completion:,",Jester's Robes,IDescription:,"A boldly-colored jester's cap/robe/gloves/tights. A nice bit of fun to try on...Jesters are more than festival fixtures; some have a second face, hidden from public view.",IType:
Prompt:,"IName:,","Completion:,",Juvenile Scholar Robe,IDescription:,"Robe worn by young academy scholars, the juveniles birthed anew by the amber egg of Queen Rennala, the head of Raya Lucaria Academy.Yet their rebirth is not without imperfections, and thus do they repeat the process, eventually becoming utterly dependent upon it.Rebirth is as sleep to them, and with each awakening, memory fades into oblivion.",IType:
Prompt:,"IName:,","Completion:,",Kaiden Armor,IDescription:,"Armor worn by Kaiden sellswords.These hulking, fearless mercenaries, said to hail from the mountaintops of the wintry north, are adept at fighting on horseback. Kaiden is the name of their home settlement.",IType:
Prompt:,"IName:,","Completion:,",Karla's Coat,IDescription:,"Cloak of the dark witch Karla. A pointed hat is the signature of a heretical sorceress. Karla, however always kept it close. This stained (Piece Name) is torn and odorous, telling of a long journey and even longer imprisonment. It would be madness to wear such a thing.",IType:
